FOIL ID,DATE OF REQUEST,REQUESTER,REGARDING,DATE RESPONSE
21161,10/23/14,NY Post,TLC's in-house analysis prepared on the 30-cent accessibility surcharge on taxis.,10/23/14
21163,10/23/14,Hereford Insurance Company,"GPS report for #AD135, plate #T644866C from 8/25/14 to present",11/14/14
21164,10/23/14,The Bronx Defenders,Copy of license info for Ousumana Konneh,10/31/14
21165,10/23/14,Hereford Insurance Company,"GPS report for #AB485, plate #T643150C from 8/23/14 to present",10/23/14
21168,10/23/14,"Law Offices of Omrani & Taub, P.C.",Information on medallion 8J60A.,10/23/14
21169,10/23/14,"Law Offices of Omrani & Taub, P.C.",Information on medallion 4H26A.,10/23/14
21182,10/23/14,Hereford Insurance Company,GPS reports for #5141994 (2013-2014); #444055 (2014); #5455613 (2013-2014).,10/28/14
21183,10/23/14,Hereford Insurance Company,GPS reports for #5167778 (2014); #5040376 (2013-2014); #460779 (2014).,10/28/14
21184,10/23/14,Hereford Insurance Company,GPS reports for #494851 (2014); #5348445 (2012-2014); #5156780 (2014).,10/28/14
21185,10/23/14,Hereford Insurance Company,GPS reports for #5233457 (2013-2014); #5101064 (2014); #5348070 (2014).,10/28/14
21186,10/23/14,Hereford Insurance Company,GPS reports for #5419088 (2014); #5038445 (2014); #447587 (2014).,10/28/14
21187,10/23/14,Hereford Insurance Company,GPS reports for #5389336 (2012-2014); #5238502 (2014); #5351327 (2012-2014).,10/28/14
21188,10/23/14,Hereford Insurance Company,GPS reports for #5267331 (2012-2014) ;#5177783 (2013-2014; #5362214 (2011-2014).,10/28/14
21189,10/23/14,Hereford Insurance Company,GPS reports for #412732 (2010-2014); #5428911 (2012-2014); #5465163 (2014); #5442269 (2014).,10/28/14
21201,10/23/14,Dongxu Xie,Contact information of driver for 3C25B,10/31/14
21195,10/24/14,"Marea L. Wachsman, Esq.",Name and address of driver of 3F32 of 10/15/14,10/27/14
21196,10/24/14,"RBA, Inc.","License application of Augustin Baez, ss #7827",11/19/14
21197,10/24/14,Law Office of John J. Ciafone,Current contact information for Mahmoud Abdellatif #427248,10/28/14
21200,10/24/14,Rafael Deodato,receipt for 10/17/14 fare from midtown west Manhattan to JFK; medallion #9K52 for $72.28,11/5/14
21283,10/24/14,Espinal Auto Corp.,"Termination of affiliation form used by El Barrios #B01065; license #5456829, plate #T620888C",2/11/15
21193,10/26/14,Michael Shoretz,Ownership and contact information for medallin 7F67,10/27/14
21194,10/26/14,Jean Alfred,Copy of Base file #B02646,12/16/14
21190,10/27/14,Hereford Insurance Company,"GPS report for #AD190, plate #T525993C from 8/8/2014 to present",10/27/14
21191,10/27/14,Hereford Insurance Company,"GPS report for #AE574, plate #T523139C from 8/11/2014 to present",10/27/14
21192,10/27/14,George Washington University,"TPEP trip fare data for total number of rides per month, average per month fom 1/1998 to 9/2014",10/27/14
21203,10/27/14,Wonjung Sang,Accident report filed by 4N56 and 7C66 for accident dated 6/6/14,11/5/14
21204,10/27/14,"Sacco & Fillas, LLP",Insurance information of plate #T642582C,11/5/14
21205,10/27/14,Charles WLDR,Copy of complaint #C1-1-1012407121 submitted on 9/12/14,11/5/14
21206,10/27/14,Community Board No. 2,"License information for Handi Car Service Corp. - suspensions, complaints, #B02703",11/5/14
21207,10/27/14,Community Board No. 2,"License information for Center of the World Car Service Corp. - suspensions, complaints, #B02696 & B02804",10/31/14
21208,10/27/14,Janet Livingston,"Copy of stipulation #10027360s , complaint #C1-1-997345121",11/5/14
21254,10/27/14,Capital One,Most current taxi cab rideship numbers through October 2014 in New York,11/14/14
21255,10/27/14,Fernando A. Martinez,Comments submitted as part of the revised taxi of tomorrow rulemaking procedure.  In electronic format,
21199,10/28/14,"Raphaelson Levine Law Firm, P.C.",Ownership and insurance information for cab#8063,10/29/14
21209,10/28/14,Fignole Joboam,Base affiliation for plate #T621778C on 8/26/14,11/6/14
21210,10/28/14,Kelly Harnett,"Info on: If TLC sponsored any sport team in 2010, any soccer team in 2010",11/5/14
21211,10/28/14,Law Office of Salmen Novaro & Lavergue,License application for Santana Jovanni aka Tobanny Santana.,11/17/14
21256,10/28/14,Hereford Insurance Company,Proof of base affiliation on 1/24/14 for T619139C,11/14/14
21257,10/28/14,Bank of America,"Receipt for ride on 9/27/14 of $7.80, cc #2428",11/19/14
21258,10/28/14,Car & Limo Service,Request of termination of vehicle affiliation with plate #T527845C and T610073C,11/17/14
21259,10/28/14,"Federal Transit, Inc.",Request of termination of vehicle affiliation with plate #T623792C and T646339C,11/14/14
21260,10/28/14,Sony/ATV Music Publishing,"Receipt of trip of 10/23/14 for $44.90, cc #3265 around 11-11:30pm",11/14/14
21212,10/29/14,Jacques Olrich,Abstract print out of license info for 415271,10/31/14
21214,10/29/14,Gary O. Naranjo,Records of TLC License for Gary O. Naranjo.,12/3/14
21228,10/29/14,Hereford Insurance Company,"Trip fare of permit #AF994, plate #T638708C from 7/26/14 to present",11/6/14
21232,10/29/14,Hereford Insurance Company,"Trip fare for permit #AF948, plate #T525066C from 8/8/14 to present",11/6/14
21234,10/29/14,Hereford Insurance Company,"Proof of base affiliation of plate #T501605C, VIN #2LNHM82V18X64xxxx, Jean Sulnay",11/5/14
21235,10/29/14,AIG Property Casualty,Dispath (base) information for plate #T629184C,11/5/14
21236,10/29/14,Gurhan Turna,Company EIN number and proof of ownership for Americas Limo LLC,1/22/15
21237,10/29/14,Thomas Markandonis,Receipt for trip taken to Laguardia airport from Manhattan 10/24/14 amount $37. ,11/6/14
21223,10/30/14,Mattie Toma,Medallion sale prices from 2004 to present,11/5/14
21224,10/30/14,"Introspect Investigations USA, Inc.","License information for dhillon kuldip, medallion 2A32",11/5/14
21225,10/30/14,"Introspect Investigations USA, Inc.","License information for Mangat Singh, medallion 9T83",11/5/14
21227,10/30/14,Hereford Insurance Company,"Trip fare for permit #AA433, plate #T641309C from 6/1/14 to present",11/6/14
21229,10/30/14,"Pillersdorf & Associates, P. C.",Insurance information of T601791C,11/5/14
21226,10/30/14,Loews Regency Hotel,Driver and Insurance information for medallion 8M63B.,10/31/14
21241,10/30/14,The Evergreen State College,receipt of trip with charge of $63.00 on 9/29/14 with medallion 6J18,11/6/14
21242,10/30/14,David Clotter,Copy of license record #5421254,11/6/14
21243,10/30/14,"Rovegno & Taylor, P. C.","History of complaints for Bobo Barry, name & address of employer, last known address",11/6/14
21083,10/31/14,"Law Office of Scott Baron & Associates, P.C.",Insurance information for plate # 6K93A.,11/6/14
21219,10/31/14,Hereford Insurance Company,"Picture of Abdelazim Ismail, license #5129919",10/31/14
21220,10/31/14,Hereford Insurance Company,"Trip sheet report for AD835, plate #T641397C from 6/14/14 to present",11/6/14
21230,10/31/14,David Coley,Average medallion prices,11/17/14
21231,10/31/14,Neil Thakral,The history of all FOIL requests submitted to the TLC,12/26/14
21238,10/31/14,Fast Help Ambulette Service,GPS data for pick up & drop off with drivers and vehicle info from 11/1/07 to 1/31/11,11/24/14
21244,10/31/14,"Scott Baron & Associates, P.C.",Insurance information 6K93A,
21281,10/31/14,The Schilitt Law Firm,"Address of Mohammed Asazuzzaman, license #5388992 driver of  medallion 7M66",11/18/14
21284,10/31/14,Salenger Sack Kimmel & Bavaro,"License Information for Min Zhu Yi, plate #T497876C, lice nse #5273129 including violations, suspensions, drug test result.",12/3/14
21285,10/31/14,Salenger Sack Kimmel & Bavaro,"License information for Sadaqat Ajaz, license #500713, plate #4C85, including violations, suspensions, drug test results.",12/3/14
21246,11/1/14,Glenda Ramirez,License record for Jadit Jules Travele alias Ja Dit Jules Tavele,11/17/14
21233,11/3/14,Lorena Page,GPS trip fare for October and November for Malick Gaye#457637,11/3/14
21247,11/3/14,Hereford Insurance Company,"GPS report for permit #AE498, plate #T643846C from 8/27/14 to present",11/17/14
21248,11/3/14,Matthew Shapiro,TPEP trip data for 2010-2012 and 2014,11/14/14
21249,11/3/14,Joshua Bricel,Trip receipt for 10/24/14 ride from 128 E. 45 Street to JFK,11/14/14
21287,11/3/14,Faisal Iqbal,Hearing decisions from 2011 to 2012. ,
21309,11/3/14,"William Schwitzer & Associates, P.C.",Insurance information of plate #T618024C,11/24/14
21322,11/3/14,Tarsem Singh Multani,"Address of Ayesha Bokhari, license #5495460/5464007; ",12/4/14
21250,11/4/14,Citi Velocity Sales,"Receipt of trip of 6/13/14 with medallion # 7L28; $17.40, cc #4532",11/14/14
21251,11/4/14,"The Law Firm of Walsh Grasso & Lefebvre, LLP",Name and contact info of owner of medallion 5N91,11/14/14
21252,11/4/14,Brian Malinchak,Receipt of ride of 10/30/14,11/14/14
21253,11/4/14,Progressive Credit Union,2014 monthly medallion average sale price & number of transfer through October 2014,11/14/14
21263,11/4/14,"Law Office of Neil Kalra, P. C.",Trip sheet data for license #5373822,11/14/14
21264,11/4/14,Hereford Insurance Company,"TPEP data for Akhhtar Sheikh, license #5105706 from 7/5/14 to present",11/14/14
21265,11/4/14,Hereford Insurance Company,Trip fare data for #441064 from 1/1/14-present; #5251950 from 8/2/14-present; #5122066 from 11/13/13-present,11/18/14
21266,11/4/14,Hereford Insurance Company,"Trip fare data for #5099364 from 9/1/12-present, #5416449 from 4/2/14-present. #5040376 from 3/16/14-present",11/18/14
21267,11/4/14,Hereford Insurance Company,"Trip fare data for #5400865 from 8/1/14-present, #5451409 from 10/19/13-present, #5198752 from 8/8/14 to present.",11/18/14
21268,11/4/14,Hereford Insurance Company,"Trip fare data for #5454924 from 5/23/14-present, #5442782 from 5/2/14-present, #5105706 from 7/5/14-present, #5388411 from 7/14/14-present",11/18/14
21275,11/4/14,Capital One Equipment Finance Corp.,FOIL request for a chronological list of all October 2014 medallion sales and transfers for both individual and corporate medallions.,11/18/14
21240,11/5/14,New York Daily News,Number of yellow taxi trips each month for the past 5 years.,1/9/15
21269,11/5/14,Halil Ibrahim Gormus,Lost wallet in taxi from 59 street to 31 street,11/18/14
21282,11/5/14,Tan Sui Hua,Date that Credit Union sold medallion 9C94 at auction and the selling price,
21289,11/5/14,"Law offices of Neil Kalra, P.C.",Trip Sheet report for license #5456011 from 11/24/13 to present,12/4/14
21288,11/5/14,Andreas Kornowski,"Taxi driver has already been identified by TLC (file code: C1-1-1027437291)  forgot at the right front seat of a taxi that drove me from Manhattan to JFK on 25th of October a backpack worth approx. 7,000 USD.",11/19/14
21291,11/5/14,Hereford Insurance Company,GPS Records for Hack # 5442728 (Lawrence Turk) for 10/21/13 to Current.,11/19/14
21295,11/5/14,Liaqat Ali,A copy of 1982 Medallion Driver license SSN# 3341.,11/19/14
21305,11/5/14,Weitz & Luxenberg,Insurance information for plate #3D61C,11/25/14
21306,11/5/14,"Weiser & Associates, LLP","Copy of complaint #1-1992379600 and information of the car license plate, insurance information",11/25/14
21308,11/5/14,Progressive Insurance,"Trip fare data for Mohammed Islam, license #502389 from 7/8/2014 to present",12/4/14
21245,11/6/14,Osei Bonsu,Information on Owusu Mensah.,11/6/14
21270,11/6/14,Barasch McGarry Salzman & Pension,Following up on FOIL request dated 07/19/2013,11/17/14
21271,11/6/14,360i.com,"Receipt of trip fare of 9/29/14 or 9/30/14 for $21; cc #7002, medallion #SBV114",11/17/14
21272,11/6/14,360i.com,receipt of trip of 10/01/14 amount $24 cc #7002 from medallion 5C96,11/17/14
21273,11/6/14,360i.com,Receipt of trip on 10/01/14 of $12.50 with cc #7002 with medallion 3N13,11/17/14
21274,11/7/14,Capital Communication Federal Credit Union,List of all medallion sold or transferred from 01/01/13 to 11/07/2014,11/18/14
21277,11/7/14,Hereford Insurance Company,"Trip Sheet report for Boubacar Dembelle, license #5148152, from 7/10/2013 to present",11/18/14
21279,11/7/14,David J. Hernandez & Associates,"record pertaining to consumer complaint #10027861, license #10027861",11/26/14
21280,11/7/14,"City Taxi Brokerage, Inc","Copy of medallion file #1J89, 1J90 & 1J91",2/19/15
21303,11/7/14,"Sacco & Fillas, LLP",Insurance information of plate #9A22B/9H21A,11/25/14
21304,11/7/14,Sean Siracusa,Insurance information for plate #T517551C,11/25/14
21292,11/10/14,Toyota Motor Sales USA,Same information for 2013 - Reference FOIL #21143,11/21/14
21296,11/10/14,BOTEC Analysis,"""Operation Refusal"" Studies by TLC-  Looking for protocol used to determine whether or not a driver is abiding by the law.",12/11/14
21302,11/10/14,"Sacco & Fillas, LLP",Insurance information of plate #T471661C,11/25/14
21213,11/11/14,"Scott Baron & Associates, P.C.",If plate number T407001C has medallion or non medallion coverage.,11/19/14
21278,11/11/14,American Express,Took a NYC yellow can on September 29th 2014 Taxi Receipt Request NYC Taxi 5B32 last 4 digits of CC#1004.,11/18/14
21117,11/12/14,Ji Hye Song,Receipt - drop off and pickup location for taxi ride on 11/09/14 Medallion 4Y58 amount $14.50.,11/19/14
21261,11/12/14,"Gair, Gair, Conason, Steigman, Mackauf, Bloom & Ru",Insurance Information for medallion 6J96H,11/18/14
21297,11/12/14,Hereford Insurance Company,SHL Permit # AE046 (GPS Records/Trip Sheet) 9/30/14 to Current,11/19/14
21298,11/12/14,Hannah Johnston,All TLC Violations and Consumer Complaints made against yellow and FHV drivers from 1/1/13 to current.,1/15/15
21299,11/12/14,"Windels Marx Lane & Mittendorf, LLP",how many out of the total number of licensed medallion drivers over the age of 70 are actively driving?,12/3/14
21300,11/12/14,John Worth,Travel Logs for Medallion 3M90 for 11/8/14 between 8pm and 10pm,11/20/14
21310,11/12/14,"Law Offices of Neil Kalra, P.C.",Mohammed Islam Tripsheet from 11/24/2013 to Present.,11/20/14
21323,11/12/14,Lawrence S. Frank,Medallion result for 2014 & the number of medallions included in the highest bid. Price of single medallion that is part of a minifleet,11/26/14
21262,11/13/14,"Council Member Ruben Wills-28th District, Queens","any objections you may have regarding  Montego Van Service and Scarlet Girl Van Line Inc. located on 158-27 147th Avenue, Rosedale, NY 11422 T.L.C. Base# B80012 and D.O.T. # 31106, which may include any open and closed complaints, and current violations.",11/13/14
21290,11/13/14,"Antin,Ehrlich & Epstein, LLP",Insurance information of vehicle from base # B01467,11/26/14
21311,11/13/14,Hereford Insurance Company,Plate T648600C (Base Affiliation),11/20/14
21312,11/13/14,Hereford Insurance Company,"Hack # 5388411: GPS Records, Trip Sheets from 07/15/2014 to current & Hack License Picture",11/20/14
21417,11/14/14,BEN HERZWEIG,"TLC records pertaining to Chong Sok So including but not limited to any administrative dispositions or actions of any sort, administrative summonses, disciplinary actions and consumer complaints.",12/18/14
21276,11/14/14,Sally A. McReynolds,Taxi Receipt Needed: 10/27/14 $26.30,11/18/14
21293,11/14/14,Premier Investigations,"License files for Outtara Salif, Salif M. Ouattara.",12/16/14
21313,11/14/14,Hereford Insurance Company,GPS reports for #5167778 (2014); #5040376 (2013-2014); #460779 (2014).,11/20/14
21314,11/14/14,Cornell University,Receipt of trip fare for 10/22/14 7pm with medallion 9F10,11/20/14
21315,11/14/14,Giovanna Coluccio,"Request for a receipt copy from a transaction on September 30, 2014.",11/20/14
21316,11/14/14,"Windels Marx Lane & Mittendorf, LLP","In relation to the transferring of New York City Taxicab Medallions including internal TLC policies, practices, procedures and/or allowances for transfer that may be available to medallion owners but which may not be codified in the TLC Rules & Regulation",
21324,11/14/14,Eric Lerner,Information pertaining to summons #FC0000180 issued on 9/17/14,11/24/14
21325,11/14/14,"NYC Interboro Management, Inc.",Insurance information of medallion 2J55,11/24/14
21327,11/14/14,Inder Mohan Singh,Suspension history for license #5359666,11/24/14
21342,11/14/14,"Antin, Ehrlich & Epstein, LLP","Insurance information for ""Car #114"" - New Experience Car Service in Long Island City.",12/3/14
21317,11/15/14,James M. Robinson,Information on driver lic #5181586  and owner information on medallion 5H57.,11/20/14
21318,11/17/14,Hereford Insurance Company,SHL permit # AB895 (GPS Records & Trip Sheet) for 9/15/2014 to Current.,11/20/14
21326,11/17/14,Jamont Joseph,Information on application procedures and requirement to apply for TLC license,12/16/14
21328,11/17/14,Denise Wilder,copy of complaint #C1-1-1012407121,11/24/14
21416,11/18/14,Jeremy Phillips,"TPEP license application materials for verifone, mobile knowledge, and CMT.",
21286,11/18/14,Salenger Sack Kimmel & Bavaro,"License Information for Bedi Parmjeet, plate #5A41, license #464657 including Violations, Suspensions, Drug Test results.",12/4/14
21301,11/18/14,"Sacco & Fillas, LLP",Insurance information of plate #T472814C,11/25/14
21319,11/18/14,Lindstadt Law PLLC,"Validation of the following information, under FOIL, in efforts to contact Mr. Diallo-  Current address and phone number",11/20/14
21320,11/18/14,Hereford Insurance Company,Hack License # 5232952 (GPS Records & Trip Sheet) for 01/01/2014 to 01/28/2014 and Hack license picture.,11/20/14
21329,11/18/14,"Gair, Gair, Conason, steigman, Mackauf, Bloom & Ru",Insurance info of medallion 2M81,11/24/14
21330,11/18/14,"Ahmuty, Demers & McManus",,
21343,11/18/14,"Ahmuty, Demers & McManus - Attorneys at Law",Owership/insurance information for 78K62- Driver ( Vishal Vohra),12/3/14
21415,11/19/14,Nilkanth Patel,2011 and 2012 Taxi Trip Data TPEP,12/18/14
21239,11/19/14,"Scott Baron & Associates, P.C.",Information on PLATE T607585C,11/20/14
21294,11/19/14,Christian Union,Receipt Request for 8/18/2014 amount 109.20 CC#4353.,12/8/14
21307,11/19/14,"Wingate, Russotti, Shapiro & Halperin, LLP",Insurance information of plate #T519962C,11/24/14
21321,11/19/14,Georgetown University,Taxi Passenger data/Trip Statistics TPEP GPS Trip/ fare  1990-2014 data,11/20/14
21357,11/19/14,Matthew Shapiro,"History of taxi fare and taxi lease limits at least back to 2000, yellow cab medallion auctions results back to 200, medallion transfer records from 2008 back 2000, ehail program data and FHV vehicle usage data.",1/5/14
21346,11/20/14,"Beacon Claims & Investigations, Inc.",Certified driving record of Mohammed Awal DMV lic#1012,12/4/14
21348,11/20/14,"Boeggeman, George & Corde, P.C.",Complete employment records on Krishanu K. Bhowmik SSN: 5931.,12/4/14
21419,11/21/14,"Frenkel Lambert Weiss Weisman & Gordon, LLP",Confirm that Malkit Singh is the owner of medallion 1F42B and that he was not permitted to sell or further encumber hi medallion since we made our request.,12/4/14
21333,11/21/14,Kang Wook Lee,"Insurance Information for the yellow cab driven by Ahamed, Tofaiel license #5305612",11/25/14
21335,11/21/14,Afdhel Aziz,Information on the company running yellow cab plate number 8L77H.,11/25/14
21345,11/21/14,"Winagate, Russotti, Shapiro & Halperin, LLP",Owner information on plate T519962C.,12/4/14
21351,11/21/14,"Israel, Israel & Purdy, LLP",Insurance company for Plate # T495695C,12/4/14
21331,11/22/14,Demetrius Braxton,Insurance information on plate 6K68B- Car accident on 10/28/2014/Complaint # 10031379.,11/24/14
21338,11/22/14,Masami Muraoka,Information on C1-1-1019684653,11/26/14
21365,11/22/14,Hereford Insurance Company,GPS reports for #385934 (2014); #508402 (2014); #5344237 (2014); #5257921 (2013-2014); #5245178 (2014); #451910 (2014); 5435426 (2014).,12/9/14
21366,11/22/14,Hereford Insurance Company,GPS reports for #5158550 (2013-2014); #4196564 (2014); #444106 (2014); #5264496 (2007-2014); #5257950 (2014); #5144850 (2014).,12/9/14
21400,11/24/14,Joseph Derosier,Copy of 26 summons from (1996-2007) -Joseph Derosier,12/17/14
21349,11/24/14,Dennehy law Firm,Information on Medallion number 4H19A.,12/4/14
21350,11/24/14,Allstate Fire and Casualty Insurance Company,Insurance Information for Medallion 4Y78A.,12/4/14
21418,11/25/14,KARIN ARROSPIDE,All documents related to Manida Car Service Inc. and license # LV-B02538.,
21332,11/25/14,Dinara Kemelbekova,Contact information for current FHV drivers in NYC,11/25/14
21334,11/25/14,Dana Brown,Inforamtion on plate number 6E19J - Driver Balwinder Singh,11/25/14
21336,11/25/14,Hereford Insurance Company,(Hack License Picture) # 429556,11/25/14
21337,11/25/14,Hereford Insurance Company,(Hack License Picture) # 465521,11/25/14
21339,11/25/14,Hereford Insurance Company,SHL Permit # AE664 (GPS Records) 7/23/2014 to Current,11/26/14
21401,11/26/14,"Julien & Schlesinger, P.C.",Any documents relating to an accident which occurred on 10/6/2014. Taxi driver did not provide any information to identify himself or the vehicle.,12/17/14
21405,11/26/14,Avram Ozsarfati,Record of the exact date medallion 7E47 was transferred and registered to owner (Avram Ozsarfati),12/17/14
21406,11/26/14,"Cruser, Mitchell & Novitz, LLP","INSURANCE -POLICY NUMBERATLANTIC CAR SERVICE",12/17/14
21407,11/26/14,The Work Number,"Employment records for Yaqub Younis		SSN: 3387",12/17/14
21409,11/26/14,Data Verify,Employment records for Mostafa MD Kamal.,12/18/14
21414,11/26/14,"Pike & Pike, PC","Application to change the base affiliation of the three vehicles, which are listed below by VIN: 4T1BD1FK0CU02xxxx 4T1BD1FK7CU02xxxx   4T1BD1FK5CU02xxxx",1/5/15
21364,11/26/14,Baldev Singh,History of hack license number 5480543 from 1/2009 to 12/2013.,12/8/14
21408,11/28/14,Steve Vornea,driver/owner/insurance information for the vehicle 7K60,12/18/14
21340,11/30/14,Jeff Novich,"Excel report of all summonses including consumer complaints issued by the TLC to divers/ 311 Call center complaints/Violation number for 2012,2013,2014. Lists of drivers license number and the bases and medallions they are affiliated with.",1/12/15
21352,11/30/14,Eugene Weixel,Under what legal authoriry are these eHail app companies presently operating in New York City?,12/5/14
21397,12/1/14,Syed Masum Billah,Information on taxi ride taken on 11/13/14.,12/16/14
21403,12/1/14,Charley Ferrari,NYC Green Boro Taxi Trip Data TPEP FOIL Request,12/17/14
21404,12/1/14,Mobility Works,"Disbursement date for the following grant numbers: AC281, AC504, AA235, AA544, AB266, AB268, AC316, AB536, AC311, AC878, AC408, AC875, AC880, AC545, AC485, AC830, AC831, AC649, AC825, AC768, AC542, AC538 and AC818.",12/22/14
21411,12/1/14,WILBERT PRINSTON,Any tickets or violations for WILBERT PRINSTON,12/18/14
21413,12/1/14,Hereford Insurance Company,GPS reports for #5437154 (2014); #5076840 (2014); #5368276 (2013-2014); #504235 (2012-2014); #5417764 (2013-2014); #4300848 (2014).,12/18/14
21341,12/1/14,Chris Whong,Trip Data for the Boro Taxi Program from August 2013 through June 2014.,12/1/14
21347,12/2/14,MTBOT,"The number of taxicabs/for-hire drivers suspended or revoked, by month, pursuant to the critical driver program, from January 2013 through the present.",12/11/14
21399,12/3/14,Gustavo Fernandez,Requesting driver name license number 5110286.,12/17/14
21402,12/3/14,Brad E. Mazarin,"Records relating to driver Said Erachadi, Medallion #461668",12/17/14
21412,12/3/14,"Rovegno & Taylor, P.C.",Complete license file on medallion taxi driver- Bobo Barry,12/18/14
21344,12/3/14,WNBC,"Records request for a database/ data set prefer excel for the names, divers license numbers and tlc licenses for all TLC licensed  drivers, is that all public record? And can we get it electronically?",12/3/14
21359,12/3/14,Barbara Burns,Receipt for taxi fare on 11/11/2014 -amount $9.00 CC#1002 Medallion 2E69,12/8/14
21361,12/3/14,Hereford Insurance Company,MED # 4C79C GPS Records and Hack license # 5299051 for 11/10/14 to current.,12/8/14
21362,12/3/14,Hereford Insurance Company,SHL Permit # AC014 - Plate # T640759C (GPS Records) for 9/25/14 to current.,12/8/14
21363,12/3/14,Hereford Insurance Company,MED # 5B18H (GPS Records) for 8/1/14 to Current,12/8/14
21371,12/3/14,Crystal Vilmen-Galla,Company/owner/contact and insurance information for the green boro cab that hit me on 11/17/14. The medallion number was #AA965.,12/10/14
21372,12/3/14,Citibank,Receipt for Medallion # 4A39 Driver #494409 11/02/2014,12/10/14
21398,12/4/14,The Schlitt Law Firm,Driving records for Julio Sanchez.,12/16/14
21410,12/4/14,George Duff,the Condition Corrected Report/Form for plate #T648206C,12/18/14
21353,12/4/14,Edwin Cudjo,Information on License # 5564207,12/5/14
21354,12/4/14,Fox Rothschild LLP,"All documents/records pertaining to data and/or statistics on the actual use or attempts to use any application-based ridesharing services, including UBER, in 2013 and 2014 in NYC.",12/18/14
21355,12/4/14,Fox Rothschild LLP,"All documents & records petaining to instances in 2013 and 2014 that any application-based ridesharing service, including but not limited to Uber,failed to respond to or accept request by a person in NYC to use ride sharing service & are maintained by TLC",12/18/14
21356,12/4/14,Fox Rothschild LLP,"All documents and/or records pertaining to complaints made in 2013 and 2014 in NYC relating to any appliation-based ridesharing service, including but not limited to UBER, and & maintained by TLC",12/18/14
21360,12/4/14,Hereford Insurance Company,Hack License # 5395290 Picture,12/8/14
21358,12/5/14,Aki Katan,Price of a medallion,12/22/14
21373,12/5/14,ISHMAEL MORRISON,TLC license history for Ishmael Morrison.,12/10/14
21374,12/5/14,Hereford Insurance Company,Hack # 5258236 Picture,12/10/14
21376,12/5/14,Marcelle Estriplet,Information on Medallion number 6L80 (Ownership),12/10/14
21384,12/5/14,Ruth Abrams,Insurance information on TLC plate #T661457C.,12/11/14
