FOIL ID,DATE OF REQUEST,REQUESTER,REGARDING,DATE RESPONSE
19980,1/2/14,The Legal Aid Society,Any and all records of complaints and disciplinary measures taken against driver Malcom Nnanna license # 5288015.,1/3/14
19981,1/2/14,Sharon Lee,Trip receipt of pickup/dropoff location details for a trip taken on 12/27/2013 Med #3Y27 amt $96.60,1/3/14
19982,1/2/14,Hereford Insurance Company,What base Wilfredo Bautista (Hack License #5293007) Plate #T634131C affiliated with on 10/15/2013.,1/6/14
19985,1/2/14,"Law Office of Avi D. Caspi, PLLC",Information on plate number T249043C.,1/8/14
19983,1/6/14,Schwartzapfel Lawyers,Information on owner of vehicle 1L53A.,1/7/14
19984,1/6/14,J. Ballard,"Information on the drivers name, company name and registrant details for Plate #T620699C.",1/7/14
19988,1/6/14,National Credit Union Administration,1. Number of corporate medallions as of 12/31/2013. 2. Number of individual medallions as of 12/31/2013.,1/22/14
19987,1/7/14,Hereford Insurance Company,Tripsheets/GPS records for MD Islam (Hack #5396737) Medallion plate 3D53 for 11/24/2013.,1/9/14
19989,1/7/14,Mintz & Gold,"All written public comments submitted for the Dec. 19 2013 TLC public hearing, including but not limited to all letters, e-mails, petitions, testimony, medical and expert opinions. Also, the transcript and minutes.",1/21/14
19990,1/7/14,Rachel Orloff,Information on license plate 1H84B.,1/9/14
19986,1/8/14,HOFMANN & SCHWEITZER,All records including ownership of Taxi Medallion 2G15,2/14/14
19991,1/8/14,Justice Hammond,Information on David Mensah.,1/9/14
19998,1/8/14,Malik Owens,Information on Driver Yasin Ozcurcu.,1/14/14
20062,1/8/14,Princeton University,2009 TPEP data,2/11/14
19992,1/9/14,Schwartzapfel Lawyers,Information on owner of vehicle plate number T504494C. DOA: 11/27/2013,1/10/14
19993,1/9/14,Style Management Co.,Information on documents showing tranfers of ownership from Teddy Martin to Bernice Rosenberg on or about Dec 1986.,1/10/14
19999,1/9/14,Brandon Choong,Address and phone number for commuter van base Flushing Van Service Base No. B80107,1/14/14
20006,1/9/14,Hereford Insurance Company,"GPS Records for Hack #5300715 (2013), 5318458 (2013), 488374 (2013), 498396 (2013), 466102 (2013), 5136142 (2009-2013)",1/16/14
20007,1/9/14,Hereford Insurance Company,"GPS Records for Hack #5149401 (2013), 5151213 (2013), 419095 (2013), 5449179 (2012-2013), 472911 (2010-2013), 5413187 (2013), 5294623 (2013), 5468947 (2013).",1/16/14
20008,1/9/14,Hereford Insurance Company,"GPS Records for Hack #369576 (2013), 5265495 (2013), 5273093 (2013), 5168466 (2013), 504265 (2013), 441509 (2013).",1/16/14
20009,1/9/14,Hereford Insurance Company,"GPS Records for Hack #445936 (2013), 5158550 (2013), 441064 (2013), 5464788 (2013), 5342175 (2013), 461266 (2013).",1/16/14
19994,1/10/14,Wolf Toder,"Copy of records or portions pertaining to Current Black Car Bases, Current Community Car Services, Current Luxury Limousine Bases, and current Community Van Authorization, including company names, name of officer and email addresses.",1/29/14
19995,1/10/14,Hereford Insurance Company,GPS records for Semyon Gufeld Hack #332030 for 9/15/2013 to current.,1/14/14
19996,1/10/14,Michael Cohen-The Trump Organization,"Information on the number of medallions operated by yellow cab SLSJET management; a licensed TLC Fleet Operator from April 1,2012, October 31,2012, April 1, 2013 and December 31, 2013.",3/13/14
19997,1/10/14,David A. King- Columbia University,TLC's LPEP and TPEP data 2012/2013,1/30/14
20000,1/13/14,Appell & Parrinelli- Attornerys at Law,Information on Medallion owner of cab plate number 9H92B.,1/14/14
20002,1/13/14,Litigation Dynamics,"Entire file including but not limited to any and all applications, license, renewal documents, reprimands, citations, suspension.",1/14/14
20001,1/14/14,New York Post,"The names of all NYC taxi drivers who have had their lic. revoked by the TLC in the past 5 years (09-2014) for point accumulations on their lic caused by DMV infractions, along with date lic was revoked. In addition, criminally along with date rev.",1/30/14
20003,1/14/14,Ayman Ibrahim,Information on violations for the past 3 years Hack # 5091024.,1/14/14
20004,1/14/14,David Beier,"Copies of all TLC Closing papers and sale contract for sale and transfer of Chain Cab Corp. Medallion 6k26, 6K27 and 6K28.",3/5/14
20005,1/14/14,Likolani Brown,Copy of all my credit card transaction in taxi cabs in 2012 with MC ending in 4234.,1/14/14
20010,1/14/14,Mr. Ricky Hakim,All citation issued to Queens Community Car Services from 1/2007 to dissolution of license.,1/24/14
20011,1/14/14,Hereford Insurance Company,Proof of Base affliation on the date of accident Juan Hurtado License #359-117-585.,1/15/14
20016,1/14/14,Jim Epstein,"Digital copy pf TLC judge ruling in a case against Sandra Matero, whose car was impounded in March 2013 for opening an unlicensed taxi.",1/17/14
20012,1/15/14,Carlos Dogbey,Address information on Mr. Kwauku medallion driver 7H759,1/15/14
20013,1/15/14,Pearl Penina Steinberg,Need proof of start address and destination. Med #8M56 Driver #395804.,1/15/14
20014,1/15/14,Helen Kelly,Information on License 374379.,1/22/14
20015,1/15/14,"Gair, Gair, Conason, Steigman, Mackauf, Bloom &","Drivers name and address of taxi driven on Saturday, November 2, 2013 at 4:30pm near intersection of Eigth avenue and west 23rd street.",1/30/14
20031,1/16/14,Edwin Cudjo,Early discharge from probation letter submitted at TLC 32-02 Queens Blvd.,1/24/14
20017,1/17/14,Michael Drucker,"Cab Driver Abdul Rafique Cab #7B16, Lic #502789",1/17/14
20018,1/17/14,Meridian Investigations & Security LLC,The last known home addresses and telephone numbers of the following active yellow medallion drivers.,1/22/14
20019,1/17/14,Morgan Stanley,Taxi receipts for 4/10/13 at 7:15am amt $59.50 Med #4F37 Amex **5002 and 4/27/13 amt $69.39 Amex **5002.,1/17/14
20023,1/17/14,Meridian Investigations & Security LLC,"The last known home addresses and telephone numbers of the following active yellow medallion drivers: Hossen Ismail, Lic# 5393201 and Mohammed N. Islam.",1/22/14
20027,1/17/14,Hereford Insurance Company,"GPS Records for Hack #5236293 (2013), 5415038 (2010-2013), 5126643 (2011-2013), 5211830 (2011-2013), 5377258 (2013), 499905 (2013).",1/27/14
20028,1/17/14,Hereford Insurance Company,"GPS Records for Hack #5116260 (2013), 497393 (2012-2013), 5290044 (2013), 5451709 (2013), 416301 (2010-2013), 5267331 (2012-2013), 5124019 (2011-2013), 5218441 (2012-2013).",1/27/14
20029,1/17/14,Hereford Insurance Company,"GPS Records for Hack #5487067 (2013), 5330131 (2012-2013), 483237 (2013), 5396249 (2013), 5441390 (2013), 5405357 (2013), 434473 (2012-2013), 472991 (2013).",1/27/14
20020,1/21/14,Proner & Proner-Attorneys at Law,Information on plate 5N94A Taxi Operator: Shahan Mohamed,1/23/14
20021,1/21/14,Gamelie Kuwonoe,All records of TLC license issued to Gamelie Kuwonoe.,1/24/14
20022,1/21/14,"Dinkes & Schwitzer, P.C.",Insurance information on plate number T601952C/NY,1/23/14
20025,1/21/14,Martin Clearwater & Bell LLP,Copy of employment records/union records for Nicholas Fazal.,1/24/14
20026,1/21/14,"Windels Marx Lane & Mittendorf, LLP",Full list of TLC licensed and approved brokers.,1/27/14
20030,1/21/14,Victora Secret,Receipts for 11/11/13 Medallion #8P96 amt $84.,1/21/14
20024,1/22/14,Sergey Zicbert,Copies of orginal For-Hire Vehicle license application #5238947 for 2010 and 2012 including all documents provided.,1/27/14
20033,1/23/14,Morgan Stanley,Taxi receipts for 1/11/14 amt $10.20 Med #2F47 Amex **1008.,1/24/14
20037,1/23/14,Gujrat Leasing Corp.,Copies of vehicle applications and attached documents belonging to Gujrat Transportation.,1/29/14
20038,1/23/14,Fred Essibor,A copy of original change of address form that was filed on 11/21/2013. Missed a hearing date because the mail was sent to old address.,2/5/14
20039,1/23/14,"Beacon Claims & Investigations, Inc","A copy of any and all Accident Reports, Incident Reports; Violations; Decisions; Appeals and Affirmations for the period July 25, 2005 through the present in connection with Cilor Josil, Lic #342642.",1/29/14
20032,1/24/14,Constance L. Breslin,Information on finding lost hat in Medallion 1C12 driver Lic #468499.,1/24/14
20034,1/24/14,Numer V. Ybanez,"A copy of Nicolas Blas TLC-issued For-Hire Driver License, including his photograph and license number.",1/27/14
20035,1/24/14,Wade Clark Mulcahy- Attorneys at Law,Employment and lost wage records of Ahmed Jalloh ,1/27/14
20036,1/24/14,Georgia Institute of Technology,"12 complete months of part Electronic Trip Record Data, for the 2013 calendar year",1/29/14
20040,1/24/14,"Colleran, O'Hara & Mills","A copy of any and all certified payroll records for all iron work performed by ABC & NY Construction, Inc. for the TLC from October 1, 2012 to date. The general contractor would be Geomatrix.",1/31/14
20041,1/27/14,Lyz Muino,Insurance Carrier for Taxi Medallion #5M58.,1/28/14
20043,1/27/14,Tariq N Ahmed,All Affiliated licensed vehicles with RAAD Limo Inc. with outstanding summons open guilty and open future dates .,2/10/14
20047,1/27/14,Aristobulo Oviedo,Copy of the leasing agreement or contract between Aristobulo Oviedo and Teresa Simon owner driver 392174 signed november 1997.,2/5/14
20042,1/28/14,Victora Secret,Receipts for 11/14/13 amt $96.99.,1/28/14
20044,1/28/14,MD Shibly Noman,Printout of hack license 5364911 and 5507789.,1/29/14
20045,1/28/14,Schwartzapfel Lawyers,Information on owner of vehicle plate number 6E75B. DOA: 12/21/2013,1/28/14
20046,1/28/14,Katz & Associates,Copies of any and all complaints against Abdelhak Akrama regarding his operating a cab on Park Avenue South (at or near East 69th street) in manhattan.,1/29/14
20048,1/28/14,Baron Associates P.C.,Ownership and Insurance information for plate number T621213C.,1/29/14
20049,1/29/14,Schwartzapfel Lawyers,Ownership and Insurance information for plate number T621213C.,1/29/14
20050,1/29/14,Security Claim Service,"Current status of Crinkle Cab Corp, Registered Owners of Medallion 8H14 and 8H13.",1/30/14
20057,1/29/14,NYU Poly,Electronic records from E-hail pilot program.,2/19/14
20051,1/30/14,Erin Hartnett,Receipt for taxi ride in Med #9C67 on 1/29/14.,1/30/14
20052,1/30/14,"Frank & Associates, P.C.","All records and files pertaining to Dail Car Inc: Applications for licensing, violations, complaints, correspondence and documents related to its affiliated drivers.",3/6/14
20053,1/30/14,Hereford Insurance Company,"GPS Records for Hack #5098345 (2013), 5490937 (2013), 5462741 (2013), 5398722 (2013), 368501 (2011-2013), 5415811 (2013).",1/31/14
20054,1/30/14,Hereford Insurance Company,"GPS Records for Hack #5353292 (2013), 453808 (2013), 5354364 (2012-2013), 5327800 (2013), 5349266 (2013), 5488099 (2013), 5040379 (2013).",1/31/14
20055,1/30/14,Hereford Insurance Company,"GPS Records for Hack #5289345 (2013), 5318695 (2013), 5401207 (2013), 487769 (2010-2013), 5116969 (2010-2013), 481746 (2013), 5141994 (2013).",1/31/14
20056,1/30/14,Hereford Insurance Company,"GPS Records for Hack #5377258 (2013), 457737 (2012-2013), 5320615 (2013), 435027 (2013), 504235 (2012-2013), 5404708 (2013).",2/4/14
20058,1/30/14,Ken Horton,Information and documents relating to the accessible taxi training.,3/27/14
20059,1/30/14,The Schlitt Law Firm,Full records regarding complaint # 1-1-850627601 -Lic# 5388992- Med #7M66,2/6/14
20060,1/30/14,"Isaac Godinger, Esq.",Copy of summons PA014168C Lic#502845 & disposition hearing on 1/24/2013.,2/18/14
20061,1/31/14,Bharat Mahajan,Information to re activate license.,2/4/14
20066,1/31/14,Morgan Stanley,Receipt for 1/28/2014 Amt:$6.00 Payment ending in 6000 for Medallion 3P62.,2/5/14
20068,1/31/14,Arjun Roy,Information on status of license ID number: 762-060-816,2/5/14
20069,1/31/14,"Dinkes & Schwitzer, P.C.",Insurance Information on taxi plate number T628761C/5C25B.,2/5/14
20075,1/31/14,"Isaac Godinger, Esq.","Copy of Summons 015722C, 015723C, 015724C for Gavriel Simkhayev lic #5128149.",2/18/14
20076,1/31/14,"Isaac Godinger, Esq.","Copy of Summons 015718C, 015719C, 015720C for Igor Valenberg lic #5471498.",2/18/14
20077,1/31/14,"Isaac Godinger, Esq.",Copy of Summons 015930C for Gavriel Simkhayev lic #5128149.,2/18/14
20063,2/3/14,Emilia Skupiewska-Sigma Capital Partners,"Detail of trip #8521 on 01/31/2014, Med #5K94.",2/6/14
20065,2/3/14,Power Investigations,"Information on driver Asmina Ruiz Flores, tickets, disciplinary action, accidents DOB:1/24/1965 ID:151301584",2/6/14
20067,2/3/14,ITV Studios,Receipt for cab ride on 1/24/2014 AMT: $8.90 NYC TAXI 3A26 Card ending in 7005.,2/5/14
20070,2/3/14,Emily Frost,Hack license of Koffi Komlani.,2/5/14
20064,2/4/14,Weill Cornell Medical College,Insurance information for yellow cab driven by Sheksadi Mohammad ID: 462860989.,2/6/14
20071,2/4/14,Shahariar Hasan,Past records of tickets and summonses.,2/5/14
20072,2/4/14,"Cheven Keely & Hatzis, Esq.",Lease agreement with independent Medallion drivers for 7M24C effective  from 9/15/2012. Financing documents/liens of Bay Ridge Federal Credit Union or others for Med# 7M24C from 9/15/2012.,3/12/14
20073,2/4/14,Pike & Pike,The record owner of 4P19 and 4P20 from January 2008 to present. All registered agents for these 2 medallions.,2/5/14
20074,2/4/14,Jeremy J. Phillips - Taxi Magic,"E-HAIL pilot program app. from the EHAIL pilot participants, E-HAIL software app. Fee Schedule, System Specifications, User Agreement, any additional doc. submitted since program approval specifically documents on TPEP DIM integration for booking trips.",3/13/14
20078,2/5/14,"Dinkes & Schwitzer, P.C.",Insurance Information on taxi plate number T628761C.,2/6/14
20082,2/5/14,"Ali Benchakroun, Esq.","Records/Information concerning whether a drivers accepting disorderly conduct charge, a violation under NY pena law section 40.20 would result in the revocation of his hack license. Also would the driver get his hack license after accepting an ACD?",2/6/14
20079,2/6/14,Hereford Insurance Company,Trip sheets/GPS records for Medallion plate #5M66C for the month of January 2014 and trip activity for Mitter Sen (Hack # 457737) from 07/14/2012 to current.,2/7/14
20080,2/6/14,Hereford Insurance Company,A copy of a TLC hearing Transcript and hearing decisions for our insured Istiaque Golam (Hack # 5121533),2/7/14
20081,2/6/14,Hereford Insurance Company,Copy of Driver of hack license #5403722.,2/7/14
20084,2/6/14,Nationwide Research,"Copies of the complaint, the judgement, and other documents associated with whatever action was taken against Gotham Yellow as mentioned in NY Post acticle 5/24/2014",3/13/14
20085,2/6/14,Hereford Insurance Company,What base is plate # T606415C was affiliated with on date of accident 9/25/12.,2/7/14
20086,2/6/14,Hereford Insurance Company,Trip sheets/GPS records for Mohammed Miah (Hack #467292) Medallion plate #7T31A for 12/26/2013.,2/7/14
20087,2/7/14,Hereford Insurance Company,"A clear copy of Tahir Muhammad Hack license # (5326761) picture, as well as, Kanwaljit Singh Hack License # (5403722) picture.",2/7/14
20088,2/7/14,Jeff Novich,"TLC complaints filed in 2012 and 2013 via 311 or TLC website with the following data:Date filed, Date & Time of incident, location of incident, taxi medallion or license(if livery car),description of incident,TLC response,Final status (driver pled guilty)",4/29/14
20089,2/7/14,"Iris Ltd., Inc",Bid tabulation for reference bid number  15614P00264.,3/13/14
20090,2/7/14,Lee- Wagner St. Louis,TLC license -copy of base license # B02624,2/24/14
20091,2/7/14,Bazyli Bibikoff,Total amount of tolls used by driver Bazyli Bibikoff Lic# 5271781 in 2013. Verification of driver Bazyli Bibikoff annual trip record.,2/24/14
20092,2/7/14,Sidiku A. Saliu,Copy of summons no. RAT03460 for Lic# 361659.,2/14/14
20093,2/7/14,Hereford Insurance Company,Clear copy of Mitter Sen Hack Licence # (457737) picture.,2/10/14
20112,2/7/14,New York Post- Gary Buiso,Violation date and any narrative information available for any moving violation triggering the revocation of a license under the critical driver program for 2009-2013. List of top 20 active lic holders with the most summonses and narrative information.,5/6/14
20098,2/10/14,"Dinkes & Schwitzer, P.C.",Insurance information on plate number T506254C.,2/11/14
20100,2/10/14,William Flavy Ritziu,"Driving record for 2012 and 2013 Hack #418367. Calculation method on 2013/All papers regarding designed driver, signed and appproved. Any relating material regarding summons MD003156.",2/24/14
20101,2/10/14,Ronald Burgess,Documents submitted for application number (260506),3/5/14
20102,2/10/14,Mohamed Nurul Houqe,Information on buying license for green taxi.,2/14/14
20109,2/10/14,ARI Fleet,Insurance information on Med #8E85A,2/14/14
20094,2/11/14,"Gerber & Gerber, PLLC",Proof of ownership of medallion 8H13.,2/11/14
20095,2/11/14,MTA NEW YORK CITY TRANSIT,Employment Verification of Badara Ly.,2/11/14
20096,2/11/14,MTA NEW YORK CITY TRANSIT,Employment Verification of Tarit K. Chowdhury.,2/11/14
20099,2/11/14,Hereford Insurance Company,Clear copy of Joseph Georges Hack licence # (5388869) picture.,2/11/14
20106,2/11/14,University of Illinois,GPS taxi data- TPEP 2010-2013,2/18/14
20103,2/12/14,Barbara J. Burns,Taxi receipts for 1/31/14 amt $11.40 Med #4F66 Amex **6000.,2/14/14
20105,2/13/14,Hereford Insurance Company,Clear copy of Mohammed Ejaz Hack licence # (5197147) picture.,2/14/14
20104,2/14/14,Patricia A. Jirak,Date of Accident: 11/22/2013 - Date of TLC Hearing: 1/27/2014 Transcript Request.,2/14/14
20107,2/14/14,Kuldip Singh,"Records showing driver Labdaoui, Ahmed pled guilty to complaint number : 447784S.",2/14/14
20108,2/14/14,Exam Works,Entire employmet file to include lost wages on Ahmed Jalloh DOB 4/12/70,2/14/14
20110,2/14/14,"Law Offices of Neil Kalra, P.C.",Trip Sheets for Mohammed I Najeeb from 11/4/12 until present.,2/18/14
20111,2/14/14,"Law Offices of Neil Kalra, P.C.",Trip Sheets for Shibli N Islam from 5/30/13 until present.,2/18/14
20114,2/17/14,Olivia Morrison - Cuny,Any documents relating to the four electric Nissan Leaf taxis that were on the road in 2013/2014 and any other electric cabs.,3/11/14
20116,2/17/14,Hereford Insurance Company,"GPS Records for Hack #5218441 (2012-2013), 5438418 (2013), 461266 (2013), 5415811 (2013), 5445752 (2013), 5157727 (2013), 5078983 (2013).",2/20/14
20117,2/17/14,Hereford Insurance Company,"GPS Records for Hack #464322 (2012-2013), 447436 (2013), 5114606 (2013), 430164 (2012-2013), 5140567 (2013), 5153119 (2011-2013).",2/20/14
20113,2/18/14,NYS Federation of Taxi Drivers,"Information related to summons issued to Livery drivers, for vehicle inspection issues for the year 2014.",3/27/14
20118,2/18/14,Andrew Flowers- ESPN,LPEP Trip Sheet Records of Boro (Green) cabs,3/13/14
20119,2/18/14,Kalia Vikas,All affiliated owners contact information.,2/19/14
20120,2/18/14,"Michael J. Hartofilis, Esq",Proof that TLC license #479118/ Sajal Das has been surrendered or revoked  and no longer valid.,2/19/14
20121,2/18/14,Jheimy Soto,"Certified records for Amadou Bizimana, copies of any registration forms or applications.",2/27/14
20122,2/18/14,Gannon Vanscoy- Citi,Receipt for transaction on 1/29/2014 Amount $61.50 CC# 1373.,2/19/14
20083,2/19/14,Delwar H. Syed,Information on hack license issued in 1991 DOB 6/15/1960 SSN: 6877,2/20/14
20123,2/19/14,"Esther Yonit Goldberg, Esq.",Information on Medallion 3K31.,2/19/14
20124,2/19/14,Gannon Vanscoy-Citi,"Receipt for taxi ride described below Date: Jan 30th, 2014, CC#1373 amt $27.00",2/20/14
20125,2/19/14,Leonard Silverman -Attorney at Law,Information of the driver of medallion 8A59 on 11/26/2013.,2/20/14
20126,2/19/14,"Dinkes & Schwitzer, P.C.",Insurance information on plate # T516247C,2/20/14
20127,2/19/14,"The Jacob D. Fuchsberg Law Firm, LLP","Mortgages, Notice of Encumbrances, Notice of Liens, and notice of claims on Medallion 8K10 and 8K11.",3/12/14
20128,2/19/14,Joseph Belzince,"Copies of summonses (Front & Back) of 539761A, 540604A.",2/24/14
20129,2/19/14,Adam Reed,Receipt for transaction on 1/26/2014 Amount $12.00 Med#9V53.,2/20/14
20130,2/19/14,Michelle Clark,Name of driver of taxi medallion #6N17/Name and contact information of the dispatcher who worked at the 34th St. penn station taxi stand on 8th avenue.,2/21/14
20131,2/19/14,Stony Brook University,Dataset of taxi fare and GPS positions collected over a one year period or more,2/21/14
20132,2/19/14,Debbie T. Dorfman-Gonzalez,Insurance information from taxi cab/driver from complaint 1-1-914698667.,2/24/14
20139,2/19/14,A. Tom Grunfeld,Obtaining copies of public records that pertain to the practices of Carmel Taxi and Car Service.,2/21/14
20133,2/20/14,Neal D'Alessio,All documents related to TLC complaint # 1-1-896342060.,2/21/14
20134,2/20/14,Nicholas Buchholz,2013 TPEP data,2/21/14
20135,2/20/14,Lankler Siffert & Wohl LLP,"Information on OATH fitness hearing No. 14/1247, the petition and Notice of hearing filed by the TLC.",2/21/14
20136,2/20/14,Ron Peles,Current address of driver Tariq Nazer.,2/21/14
20137,2/20/14,Kevin Spieser,taxi data request 2013 TPEP,2/21/14
20138,2/20/14,Hamid Ardoiz,Information on taxi driver of medallion 4k82C for accident 1/25/2014 at 10:30pm.,2/21/14
20115,2/21/14,"Sobel Ross Fliegel & Stieglitz, LLP",Information on taxi number (6130).,2/26/14
20140,2/21/14,Sonia Banegas,"Receipt from the cab taken on February 14, 2014- Need drivers medallion number, license and any additional information that may help file a lost property report.",2/21/14
20141,2/21/14,Hereford Insurance Company,"GPS Records for Hack #5144850 (2013), 494338 (2013), 497694 (2012-2013), 5323731 (2013), 5279386 (2012-2013), 5409474 (2013), 5339516 (2013).",2/25/14
20142,2/21/14,Hereford Insurance Company,"GPS Records for Hack #5467477 (2013), 5048596 (2011-2013), 438611 (2013), 420898 (2013), 5008264 (2010-2013), 5257634 (2010-2013).",2/25/14
20143,2/21/14,Hereford Insurance Company,"GPS Records for Hack #330312 (2013), 5178235 (2013), 5474292 (2013), 5445378 (2013), 480379 (2013), 455247 (2013).",2/25/14
20144,2/21/14,Hereford Insurance Company,"GPS Records for Hack #443317 (2013), 465844 (2013), 5070033 (2013), 404487 (2011-2013), 5327800 (2013), 5168466 (2013), 5271531 (2013), 5258873 (2011-2013).",2/25/14
20145,2/21/14,Carlos A. Lozada,Copy of summons 998066A issued in 7/22/2005 to lic# 5205384.,2/24/14
20146,2/21/14,"Montfort, Healy, McGuire & Salley LLP",H.M. Ziaur Rahman ,3/12/14
20147,2/21/14,"Surdez & Perez, P.C.",Insurance information for 6C99B- Graciela Saldana Ortega D/A: 4/27/12,2/24/14
20148,2/21/14,"Surdez & Perez, P.C.",Insurance information for 6C99B- Maximilliano Ortega D/A: 4/27/12,2/24/14
20180,2/21/14,"Pavlounis & Sfouggatakis, LLP",Employment records for Lawrence Deguilme SSN: 9726,3/7/14
20151,2/22/14,Hereford Insurance Company,Trip sheets/GPS records for Babar Majeed (Hack # 5271531) Medallion plate #3D14C for 9/28/13 to present.,2/26/14
20152,2/22/14,Johnny A. Reinoso,All current and active community car service (livery) bases email address and fax numbers.,2/26/14
20154,2/22/14,Andrew Salzberg,LPEP data,2/27/14
20149,2/25/14,Lance Willoughby,Taxi receipt for 1/28/14 amt $10.90/ CC#9675.,2/26/14
20150,2/25/14,"Lenox Car Services, Inc.",Proof that vehicle T620668C is not affiliated with Lenox Car Service.,2/26/14
20153,2/25/14,Global Transportation,1. How many permits were re-sold? 2. What is the a) lowest b) highest c) average resale prices?,3/24/14
20155,2/25/14,Elizabeth Nahar,Receipt for cab ride on 12/19/13 NYC taxi 1J58 Amt $12.50.,2/26/14
20160,2/25/14,Abhishek Nagaraj,GPS data 2009-2014,2/27/14
20156,2/26/14,Luz Salazar,Driving record for Luz Salazar lic # 5298108 TLC from 2010-2011.,2/27/14
20157,2/26/14,Angela Zhu,Record of fare from the vicinity of 265 Bowery to the vicinity of 88 Greenwich on the night of 2/19/2014 between 9:30 and 10:45 pm.,2/27/14
20158,2/26/14,Eugene Weixel,"All email between the chair David Yassky  and Bhairavi Desai and all officers, attorneys of the New York Taxi Workers Alliance (NYTWA) dunring 2013/2014",3/20/14
20161,2/26/14,"Stuart R. Shaw, Esq.",Insurance information 5N80A.,2/27/14
20159,2/27/14,"Becker & D'Agostino, P.C.",Insurance information on medallion 2A40.,2/27/14
20168,2/27/14,John S. Asmah,Full files and records on TLC lic # 476881.,3/12/14
20162,2/28/14,Hereford Insurance Company,"GPS Records for Hack #478329 (2013), 5416721 (2013), 5450038 (2012-2013), 5180436 (2012-2013), 5306102 (2012-2013), 5442782 (2013), 5070033 (2013).",3/10/14
20163,2/28/14,Hereford Insurance Company,"GPS Records for Hack #5474292 (2013), 5361067 (2013), 5200492 (2008-2013), 5130967 (2013), 456174 (2013), 461266 (2013), 5358878 (2013).",3/10/14
20164,2/28/14,Hereford Insurance Company,"GPS Records for Hack #508570 (2009-2013), 5354364 (2012-2013), 473430 (2013), 5091504 (2013), 489318 (2011-2013), 5216101 (2013), 5417764 (2013), 5419433 (2013), 5457544 (2013).",3/10/14
20167,2/28/14,Garth King,Insurance information on plate T637674C.,3/6/14
20173,2/28/14,The Bronx Defenders,Any and all documents relating to Yacouba Soule,3/12/14
20174,2/28/14,Natalie Vartanian,Information on taxi ride 2/27 or 2/28 for cash transaction for the amt of $26.50/$27.50.,3/5/14
20175,2/28/14,"Sabaj Law, PC",Person with the credit card number ending 8992 was involved in a car accident.,3/12/14
20176,2/28/14,Darren Crowson,Copy of report from research about card acceptance in taxis in New York.,6/3/14
20184,3/2/14,Carman Williams,Isurance information on medallion 3F68/ GPS on 3/2/2014 along with driver history.,3/7/14
20165,3/3/14,Ashley Woosley,"Verification that For-Hire-Driver Jose R. Pichardo, Lic # 500420 SSN# 4772",3/5/14
