FOIL ID,DATE OF REQUEST,REQUESTER,REGARDING,DATE RESPONSE
20409,4/21/14,Prime Time Transportation,Documents stating the date when vehicle license #5419061,5/5/14
20367,4/22/14,Hereford Insurance Company,Tripsheet and GPS records for Sat Pal Hack license # 428183/Medallion 5F11 for 3/20/2014-3/22/2014.,4/23/14
20368,4/22/14,Hereford Insurance Company,VIN # 5TDYK3DC0ES41xxxx - Base affiliation,4/23/14
20369,4/22/14,Hereford Insurance Company,Tripsheet and GPS records for Fred Edmond Hack license # 5260535/Medallion 4B31 for 8/24/2013- current.,4/23/14
20372,4/22/14,ABDULHADI CHALATI,A record of TLC license # 5386848.,4/24/14
20376,4/22/14,Eugene Weixel,"Notification sent to taxi fleets regarding Justice Margaret Chan's ruling against NYC, specifically Gotham Yellow LLC about collecting the six cents.",5/21/14
20380,4/22/14,Mohammed Islam,Hack licesnse records: #5330350 and #5528501.,4/28/14
20391,4/22/14,Mind Spring,"1)All source data files from all eHail Pilot participants (Uber, Hailo) submitted for quarterly reporting for 1/1/14-3/31/14. 2) Quarterly report for 12/1/13-2/28/14",5/7/14
20371,4/23/14,New York Civil Liberties Union,"(RFI) Regarding Anti-Speeding Technology Released On April 16, 2014.",5/21/14
20373,4/23/14,"Law Office of Robert Dembia, PC",The name and address of the owner of 2P26H.,4/28/14
20377,4/23/14,Walmer Tema,Any liens against Medallion 6B97.,5/22/14
20383,4/23/14,"Titone & Serlin, LLP",Records on licensee 459706 Claude Lessage.,4/29/14
20397,4/23/14,Kaplan & Kaplan Attorneys at Law,Licensee address Zaved Zoha Palak License #447052.,5/21/14
20402,4/23/14,Hereford Insurance Company,GPS Records/Trip Sheets for Andre Hugo license # 432413 Medallion #4E99 from 3/19/2014 to present.,5/5/14
20374,4/24/14,Amal Sokkar,A Log of the leasing drivers names for Medallion 3T55A.,4/28/14
20387,4/24/14,Rochester Medical Transportation,"If NYSDOT contract carrier permit our operation and begin operation in NYC as a contract permit carrier, do we have to be under TLC/paratransit jurisdiction and authority?",7/3/14
20405,4/24/14,"Pike & Pike, PC","Base license app. & renewls for the four base names license #s are: 1. Hinter, LLC, #B02598 2.  Weiter, LLC, #B026173. Schmecken, LLC, #B026824. Unter, LLC #B02512",5/12/14
20384,4/25/14,"Simonson Hess Leibowitz & Goodman, PC",Owner of Medallion 3M96B.,4/29/14
20386,4/25/14,Saidou Diallo,"TLC License Denial Saidou Diallo, NYDL#6054.",5/5/14
20388,4/25/14,"Kantrowitz, Goldhamer & Graifman, P.C.","How many medallions owned by Cristescu, Gheorge license #417065 and Hussain, Gazi license #503532 & 5041471.",5/5/14
20389,4/25/14,Member Brokerage Service-LLC,"Contact information for medallion driver Warraich, Arshad license #5005094 need current address and phone number.",5/2/14
20390,4/25/14,Allen S. Ganz,1)12 hour taxi lease charged to drivers by Iris Taxi in the year of 1994. 2) 12 hour lease charged to drivers by Metro Cab/Metro Taxi between 1994 and 1996.,5/21/14
20393,4/25/14,Wade Clark Mulcahy,"Provide with the make, year and color of each vehicle that operated in connection with or as a licensee of STM Enterprises Lic. No. B01522 in 2011",9/18/14
20417,4/25/14,Elliot J. Fishman PC,Certified record of Arthur Cab Leasing Corp. Medallion 1H54.,5/7/14
20375,4/28/14,"Creative Mobile Technologies, LLC",E-hail information,9/18/14
20382,4/28/14,Nathan Kessar,The names of the owners of Card Trans Corp Medallion 1K25 and 1P27.,4/28/14
20385,4/28/14,Committee For Taxi Safety,"To provide Monthly numbers since inception of the SHL program , when SHL vehicles were 'hacked up"". The number of such hack-ups each month since inception of the program is sufficient with the addition of the specific and separ",5/2/14
20392,4/28/14,The Washington Post,Taxi trip and fare data in machine-readable format for all available years.,5/2/14
20412,4/28/14,Amjad H Shah,TLC license records for hack # 5195093.,5/6/14
20416,4/28/14,Mike Mellis Brokerage Inc.,Purchase price of medallion 2E89.,5/22/14
20381,4/29/14,Hereford Insurance Company,GPS inforamtion on medallion 9L11 dates 9/11/11-9/15/11.,4/29/14
20399,4/29/14,Hereford Insurance Company,What base VIN # 1G6KD57Y77U21xxxx was affiliated with on 9/16/2010.,5/2/14
20400,4/29/14,"Wolf & Fuhrman, LLP",Information on D&B Service Inc.,5/2/14
20401,4/29/14,Siar Risvanoglu,1) Identity of the owner of medallion 4D81. 2) The price and date which the owner purchased 4D81. 3) The current average market value for said medallion.,5/22/14
20403,4/29/14,Justin Feldstein,Documents to identifies the owner and driver of the taxi that a summons was issued to.,5/5/14
20404,4/29/14,Legal-Aid Society,What base is Saif A. Chaudhry is affiliated with.,5/5/14
20414,4/29/14,Taxi Magic,Looking ride & fair trip data for FHV for the past year.,5/7/14
20415,4/29/14,Success Academy Harlem 2,Taxi cab receipt for ride on 4/14/2014 total cost $7.70 last 4 digits of CC 8529.,5/8/14
20394,4/30/14,Greenberg Traurig,"Copies of all submissions received regarding RFI for ""Black Boxes"" to support Vision Zero.",5/2/14
20398,4/30/14,Olga Rodriguez-Aguirre,Receipt for Taxi Services on 2/5/2014 for $52.50 Medallion 8P56.,5/2/14
20410,4/30/14,Raphaelson Levine Law Firm P.C.,Ownership information on medallion 3J20A from 1/1/2013.,5/6/14
20411,4/30/14,"Leav & Steinberg, LLP","Insurnance information on medallion 9A71H, requested the medallion not be tranferred without prior notice.",5/6/14
20413,4/30/14,"Sacco & Fillas, LLP",Insurance and Owner information on Medallion 5F80B.,5/6/14
20419,4/30/14,Vikas Kalia,Drivers data for Base B02089.,5/30/14
20420,4/30/14,Alex Zamoshchin,GPS data for taxis in NYC since 1/1/2000,5/7/14
20395,5/1/14,"Scott Baron & Associates, P.C.",Prevent the transfer of Taxi plate # T527258C and insurance information,5/2/14
20396,5/1/14,Arie L Ehieli,"Receipt for taxi ride 4/25/2014, Time 12:46pm- 1:08pm, Medallion 2G28-Trip #2030.",5/2/14
20406,5/1/14,"Wingate, Russotti, Shapiro & Halperin, LLP",Complete employee file on Annette M. Murano. SS# 9121.,6/20/14
20407,5/1/14,The Law Office of Joseph M. Eckstein,Complete employee file on Gary Edey. SS# 5067.,5/7/14
20408,5/1/14,Litigation Dynamics,"Entire file including but not limited to any and all applications, licenses, renewak documents, reprimands, citations, suspension.",5/29/14
20421,5/1/14,Tanya Stephen,Reciept for taxi ride on 4/8/2014 Medallion 7B78 amt $80.,5/7/14
20422,5/2/14,Samuel Hirshman,NYC TLC TPEP Trip-sheet data 2009-2013.,5/8/14
20424,5/2/14,"Federal Defenders of New York, Inc",Any and all records pertaining to Rafael Francisco Batista.,5/15/14
20425,5/2/14,Lawrence Tan,Receipt or documentation for taxi ride on 4/18/2014 Medallion 9V17,5/8/14
20426,5/2/14,Hereford Insurance Company,GPS Records/Trip Sheets for Nadeem Hameed Butt (Hack License #5104827) MED # 9A44 on 4/22/14 to current.,5/8/14
20427,5/3/14,William Carter,Information to inform vehicle owners that the base has been sold and there are no longer affiliated.,5/9/14
20428,5/4/14,Lenox Car Service,"Registered Owner address for the purpose of termination of affliation: Barrie Mamadu, W #5360393 Plate #T525657C.",5/9/14
20418,5/5/14,Geoffrey Andersen,"Investigation: 2011 into fare refusal by NYC taxi drivers, 2011 taxi availability during evening rush hours, 2010 over cellphone use by drivers,2007 medallion auction rules, 2006 taxi driver overcharging of out-of-town visitors.",7/3/14
20429,5/5/14,Dash Labs,"Responses to TLC ""Black Boxes"" RFI",5/8/14
20423,5/7/14,Windels Marx Lane & Mittendorf,Anti-speeding and driver alert vehicle Technologies RFI responses,5/15/14
20430,5/7/14,Neal Greenbaum,"copies of documents to prove medallion or the price of stock for following corporation/medallion shareholder transactions. BARNACLE TRANS - 6/3/86 - KAREN GREENBAUM - PURCHASED 50% OF STOCK - $85,000.",5/21/14
20431,5/7/14,"Isaac Godinger, Esq.","All TLC records, including license applications pertaining to GRIGORYAN,SAMVELD.O.B- 3/12/1964.",6/6/14
20432,5/7/14,Wontae Yang,NYC taxi trip data from 1/1/2013 to present.,5/8/14
20433,5/7/14,"Voyager Picture, LLC",Trip Sheet Report for NYC Taxi Ride 11/10/2013 Medallion 7C14 amt $11.,5/8/14
20434,5/7/14,"Taubman Kimelman & Soroka, LLP","All documents relating to IGOR OBERMAN and any disciplinary charges, complaints while he was employed in any capacity with the City of New York.",7/3/14
20435,5/8/14,Leonard Silverman- Attorney at Law,Worker compensation insurance for plate # T638141C.,5/8/14
20436,5/8/14,Elizabeth Oshea,"Information on owner name, phone number for complaint # 10016587S medallion 8K33",5/9/14
20437,5/8/14,Hereford Insurance Company,"GPS Records for Hack # 5280032 (2013-2014), 5025200 (2013-2014), 5455613 (2013-2014), 5131869 (2013-2014), 5265531 (2014), 5118950 (2012-2014), 5242082 (2013-2014).",5/15/14
20438,5/8/14,Hereford Insurance Company,"GPS Records for Hack # 5294949 (2014), 460186 (2014), 5371812 (2013-2014), 415004 (2013-2014), 5377258 (2013-2014), 486048 (2013-2014), 483237 (2013-2014), 429556 (2013-2014).",5/15/14
20439,5/8/14,Hereford Insurance Company,"GPS Records for Hack # 5350829 (2013-2014), 5487067 (2013-2014), 5413187 (2013-2014), 476073 (2010-2014), 494359 (2013-2014).",5/15/14
20440,5/8/14,Hereford Insurance Company,"GPS Records for Hack # 5059721 (2012-2014), 490235 (2013-2014), 448082 (2014), 5349266 (2013-2014), 5458284 (2013-2014).",5/15/14
20464,5/8/14,Look Media,Which taxi medallion owners have rooftop advertising permits and which do not. All information useful to contact medallion owners- Separate lists for yellow and Green taxi fleets.,7/3/14
20450,5/9/14,Power Investigations,Information on driver Jean Charlitte DOB: 5/30/1957,5/15/14
20456,5/12/14,Arshad K. Butt,License 428350 Information on summons number 452236C.,5/15/14
20461,5/12/14,"Cobert, Haber & Haber",Entire medallion transfer file for the closing of medallions #1Y89 and 1Y90,5/23/14
20441,5/13/14,"Simonson Hess Leibowitz & Goodman, P.C.",Owner Information on Medallion # 8V51H.,5/15/14
20445,5/13/14,"Bernstone and Grieco, LLP",Verify base affiliation on NYS Plate no. T630565C,5/15/14
20451,5/13/14,Sony Music Entertainment,Taxi receipt for 2/4/14 amount $69.39.,5/15/14
20453,5/13/14,NY Times,yellow/green cab GPS data 2012-present,5/20/14
20454,5/13/14,Law Offices of Eric Franz,A copy TLC Application number 5469477 Ehab Zied and the status of his application.,5/29/14
20500,5/13/14,Anti-Defamation League,Results of settlement between TLC and driver of medallion 3L51 case involved driver wearing a Nazi armband.,5/14/14
20442,5/14/14,"Bernstone and Grieco, LLP",Verify base affiliation on NYS Plate no. T518953C,5/15/14
20443,5/14/14,"Lawrence J. Wertheimer, P.C.",Registered owner of Medallion number 2C84.,5/15/14
20444,5/14/14,"Banilov & Associate, P.C.",Identity of the owner of Medallion 6B27H.,5/15/14
20446,5/14/14,"Law Offices of Omrani & Taub, P.C.",Information on Medallion 4J12 - Iddy Biddy Cab Corp.,5/15/14
20447,5/14/14,"Law Offices of Omrani & Taub, P.C.",Information on Medallion 2Y79B - Patty Taxi Corp.,5/15/14
20448,5/14/14,"Cobert, Haber & Haber",Transcript of hearing for summons number 70810072A.,5/15/14
20449,5/14/14,"Cobert, Haber & Haber",Transcript of hearing for summons number 70810073A.,5/15/14
20459,5/14/14,"Titone & Serlin, LLP",Trip logs for the last 3 years for license 459706.,5/19/14
20460,5/14/14,"Arye, Lustig & Sassower, P.C.","Any accident reports concerning Zavon Gordon/ Alexis Van Lines, Inc. Plate No. 19892LV.",5/19/14
20462,5/14/14,Jaroslawicz & Jaros LLC,"Summons information #CC413114C/ PV001845, Decision of 12-20-2011 on respondents appeal, TAMIS printouts showing notifications.",5/19/14
20452,5/15/14,"Anthony P. Borden, Esq., P.C.",Insurance information on vehicle T607482C.,5/15/14
20455,5/15/14,Hereford Insurance Company,Verify if hack license #495990 is linked to DMV lic# 6540.,5/15/14
20457,5/15/14,Kala Russell,Receipt for paid taxi ride.,5/21/14
20465,5/15/14,VentureBeat,"Access to copies of emails, letters, and other forms of documented communication between the NYC TLC and the Taxicab, Limousine & Paratransit Association from January 1, 2013 to May 14, 2014 particulary those in reference to Uber Technologies Inc.",9/18/14
20466,5/15/14,VentureBeat,"Access to copies of emails, letters, and other forms of documented communication between the NYC TLC and Uber Technologies Inc. from January 1, 2013 to May 14, 2014 particulary those in reference to ride sharing, related services such as Lyft and Sidecar,",9/18/14
20467,5/16/14,Shoaib Muhammed,Any and all correspondence from Licensing Division regarding the retirement date of the vehicle was hacked up to 1P76 from August 2008 thru August 2013. Any and all inspection records from TLC woodside Inspection Facility.,5/27/14
20469,5/18/14,Mind Spring,"All source data files from all eHail Pilot participants (e.g. Uber, Hail, etc.) submitted for quarterly reporting from December 1, 2013 to February 28, 2014 for compliance with the pilot program.",5/20/14
20463,5/19/14,"Titone & Serlin, LLP",If Cab #5B64 is being rented out by other drivers.,5/19/14
20468,5/19/14,Raymond Jean-Baptiste,Copy of TLC License ,5/19/14
20470,5/19/14,Jed Pavlovich,"Information on taxi driver Jaffori Syed, Jaffari Syed, Jaffri Syed, or Saleah Jaffri.",5/23/14
20471,5/19/14,Tanya Stephen,"Trip sheets for trips on 4/22/14 -Med 4N82 $28.50, 5/6/14 -Med 5E22 $26, 5/8/14 -Med 4E50 $27.50.",5/20/14
20472,5/19/14,Nick Kauchak,A receipt for a taxi trip Card ending in 3332 to 29th street Astora Queens. Amount $30.,5/20/14
20473,5/19/14,ITV Studios,"Trip summary 4/24/14Total: $10.20NYC Taxi 8J89Card used was a Mastercard ending in 0781.",5/20/14
20474,5/20/14,"Elliot Ifraimoff & Associates, P.C.",Insurance information on medallion plate 5L50A.,5/20/14
20476,5/20/14,Malapero & Prisco LLP,"Copies of documents regarding licensing and registration of the following companies: Chapincita Limo Corp., Chico Express Service Corp., Chico Express Corp",9/18/14
20477,5/20/14,Doral Bank,The number of taxi medallions in circulation?  Is it possible to know how many are corporate and how many are individuals?,5/21/14
20481,5/20/14,"Law Offices of Neil Kalra, P.C.","Trip sheet request for Mr. Gurbinder Singh, d/o/b: 9/17/1971, SS: 0951- From 11/04/2013 to Present.",5/20/14
20488,5/20/14,Hereford Insurance Company,GPS Records/ Trip  sheet for SHL permit # AC727 - Plate # T641236C on 4/22/2014 to current.,5/29/14
20478,5/21/14,Law Office of Cohen & Jaffe LLP,Insurance information on plate # 9K39H.,5/21/14
20479,5/21/14,Feinstein & Feinstein Attorneys at Law,Information on plate number T636848C- Owner Sameh A. Abdulrub.,5/22/14
20480,5/21/14,Law Office of Vaccaro & White,All TLC records concerning Muhammed Rakebu hack license # 5378956.,6/20/14
20483,5/21/14,,Insurance company information Med #1L80 Driver # 5140380,5/27/14
20484,5/21/14,Abdourahmane Bah,Information on owner of vehicle plate number T6423613C.,5/27/14
20482,5/22/14,Hereford Insurance Company,What base was Plate # T615231C affiliated with on 1/21/13.,5/22/14
20486,5/22/14,"Bernard H. Broome, Esq.","Year, make and model of taxi license plate no. 9N11A.",5/27/14
20487,5/22/14,"Joseph T. Mullen, Jr. & Associates","Name, address and telephone number of the owner of Medallion 4B30.",5/27/14
20489,5/22/14,Moussa Kaba,Information on the date of TLC application for Moussa Kaba.,5/27/14
20490,5/22/14,"Bernstone and Grieco, LLP",Verify base affiliation on the date of the accident for the following TLC vehicle: NYS Plate No: T629012C Date/Accident: 12/9/13.,5/27/14
20493,5/22/14,"Daniel Hymowitz, Esq.","Records of all trips performed by TLC vehicles of Volga Transportation Corp. TLC No. B90395-paratransit from August 1, 2011 to December 31, 2011.",5/29/14
20485,5/23/14,State of NY Wokers Compensation Board,Certify copy of the owner of T629961C.,5/27/14
20499,5/23/14,David Aaron Hahn,Receipt for taxi ride on 4/14/14 Amount $38.50.,6/2/14
20508,5/25/14,Epoch Times,NYC Boro Taxi trip data- 8/2013 to current.,6/2/14
20491,5/27/14,,"Zine Tazi LLC, Dimitrios Galanopoulos, Zine Taxi LLC- Ownership documentation, licensing, any applications.",6/20/14
20492,5/27/14,Joseph Fischer,"All records showing the applications, renewal applications filed by Al Mamunur Rashid.",5/28/14
20494,5/27/14,"Bernard H. Broome, Esq.",vehicle inspection report as of 6/19/13 for Plate No.: 9N11A.,5/28/14
20496,5/27/14,Dan Hewins,"Receipt for taxi ""NYC LPEP Long Island C NY 4/16 amt $51.50 and receopt for taxi ""NYC Taxi 7H87"" amt $ 44.00",5/29/14
20497,5/27/14,Krishna Kumar Sanganeria,Need photo of driver of Medallion 6A51.,5/29/14
20498,5/27/14,David Ripps,"Name and medallion number of the driver who picked up two people on 5/21/2014, 10:45pm at JFK.",5/29/14
20503,5/27/14,Cohen & Jaffe LLP,Insurance information for medallion number 9K39H.,6/2/14
20506,5/27/14,Hereford Insurance Company,What base was Plate # T615231C affiliated with on 1/21/13.,6/2/14
20520,5/27/14,Alex Schwartz,"License information for Bueno, Felix- Baloian, Edvard- Avulov, Eduard- Aminov,Grigoriy- Dextre, Ricardo- Isakov, Iosif- Kaz, Anatoliy- Reyes, Manuel.",6/5/14
20650,5/27/14,Toyota Motor Sales USA,"Listing of ALL NYC TLC vehicles, encompassing the following defined NYC TLC license categories (2012) annual report lists 57k vehicles):	FHV - Black, Community (livery) & Luxury	Commuter van	Para Transit 	 SHL	Yellow medallion taxi",7/3/14
20507,5/28/14,The center for Popular Democracy,"Information that TLC implementation of and compliance with Local Law 29 of 2000, the New York City Pro-Voter Law.",8/5/14
20532,5/28/14,"Law Office of Asta & Associates, P.C.",Insurance Information on Medallion 3Y62A.,6/6/14
20538,5/28/14,"Law offices Downing & Peck, P.C.",Information on KJI Limo Corp.,8/4/14
20495,5/29/14,State of NY Wokers Compensation Board,Called in to request the principals of Queens Village Inc. Lic # B00031.,5/29/14
20501,5/29/14,Skillman & Abate LLP,Driver information on plate number T512075C/ Insurance Information,6/2/14
20502,5/29/14,Power Investigations,Any and all information regarding driver James F. Vazquez ,6/2/14
20504,5/29/14,,Receipt for taxi ride on 5/11/14 Amount $5.70.,6/2/14
20510,5/29/14,Value Trans,"The name and address and contact information for the following four (4) Ford Van vehicles with following VIN Numbers: 1FBSS31L36DA95xxxx, 1FBNE31L06DB3xxxx, 1FBNE3BL8ADB0xxxx AND 1FTNE2EW2ADA8xxxx.",6/3/14
20511,5/29/14,Progressive Insurance,Activity Log for Medallion #1889 for dates 1/1/14-present.,6/3/14
20512,5/29/14,Demarcus Frazier,Requesting driver and insurance information.,6/2/14
20526,5/29/14,Hereford Insurance Company,"GPS Reports for #459833 (2010-2014), #5235810 (2013-2014), #441680 (2010-2014), #5304959 (2013-2014), #5026068 (2014), #5294920 (2013-2014), #5128706 (2014).",6/11/14
20527,5/29/14,Hereford Insurance Company,"GPS Reports for #5238011 (2013-2014), #5184435 (2014), #5293800 (2014), #422149 (2014), #5159015 (2013-2014), #5371812 (2013-2014), #5182399 (2010-2014), #412732 (2010-2014).",6/11/14
20528,5/29/14,Hereford Insurance Company,"GPS Reports for #441116 (2014), #460186 (2014), #5357119 (2013-2014), #5320352 (2011-2014), #5405357 (2013-2014).",6/12/14
20505,5/30/14,Tom Cartelli,Receipt for taxi rides on 5/02/14 Amounts $9.60 and 15.50 AmEx ending in 7247..,6/2/14
20515,5/30/14,"The Law Office of Joseph H. Navin, Esq.",Employment records of Mohammad Misgar from  1/1/2011 to present.,6/4/14
20514,6/2/14,Greenberg Traurig,"All records containing the pick-up and drop-off locations of all passengers trips recorded for the Street Hail Livery permit holders (aka Boro Taxi's), from the date of inception of the program to present.",6/4/14
20516,6/2/14,Starr Companies,Copy of reciept for fare on 5/2/2014 Medallion number 3N34 amount $52.83.,6/4/14
20517,6/2/14,"Dinerman Bergam & Dinerman, LLP",Insurance information for plate number T604978C.,6/4/14
20518,6/2/14,Elliott Jefferson- DIN #10R3218,Information on operating a 15 passenger Van in NYC.,6/4/14
20519,6/2/14,John Topna,A copy of For Hire Vehicle drivers license issued in 2011.,6/5/14
20536,6/2/14,Barry Waldman,"Reviewing files regarding two mini-fleet corporations that were sold   by the late Jacob Elberg.The two corps in question were sold   between 1992 and 1996.  1) N.Y. CRESCENDO TAXI CORP. (8P34 & 8P35) and2) N.Y. MURAL TAXI CORP.",6/9/14
20569,6/2/14,"Pike & Pike, PC","Hinter, Weiter, Schmecken and Unter documents.",6/17/14
20533,6/3/14,Aaron Comins,"The name, driver ID number and name of garage for the driver who was involved in complaint number 1-1-908488480.",6/6/14
20537,6/3/14,Jonathan Ballard,"Historical number of black car drivers, permits, and vehicles registed in NYC over the past 10 Years.",7/3/14
20513,6/4/14,Bloomberg News,Uber Technologies Inc.'s application to become an Authorized E-hail App. Provider under the TLC's E-hail Pilot Program.,7/2/14
20529,6/4/14,Hereford Insurance Company,What base VIN# 1LNH84W74Y67xxxx was affiliated with on 11/07/2013.,6/5/14
20530,6/4/14,"EAS INVESTIGATIONS, INC.",License No. 5427467.,6/5/14
20531,6/4/14,Taxi Magic,Ride and Fare data for FHV for the past year.,6/6/14
20534,6/4/14,Watertown Correctional Facility,Information on owning an Ambulate Service.,6/6/14
20542,6/4/14,"Wingate, Russotti, Shapiro & Halper",Owner and Driver information on medallion plate # 4P73A,6/20/14
20521,6/5/14,Hereford Insurance Company,"GPS data on:Name: Mohammad KhanHack:  5284079Dates: 8/27/13  present",6/5/14
20522,6/5/14,Hereford Insurance Company,"GPS Reports for #5070033 (2013-2014), #5226260 (2013-2014), #5289345 (2013-2014), #5323386 (2013-2014), #5290044 (2013-2014), #5218441 (2012-2014), #5078983 (2013-2014).",6/10/14
20523,6/5/14,Hereford Insurance Company,"GPS Reports for #422324 (2012-2014), #5269480 (2011-2014), #5309106 (2011-2014), #5368286 (2013-2014), #497393 (2012-2014), #5175049 (2010-2014), #404487 (2011-2014).",6/11/14
20524,6/5/14,Hereford Insurance Company,"GPS Reports for #5445388 (2014), #5303819 (2012-2014), #5349604 (2013-2014), #5446008 (2013-2014), #369576 (2013-2014), #5114268 (2013-2014), #504235 (2012-2014).",6/11/14
20525,6/5/14,Hereford Insurance Company,"GPS Reports for #5069935 (2014), #402601 (2011-2014), #464962 (2013-2014), #5354364 (2012-2014), #485805 (2014), #5447349 (2014), #5467081 (2013-2014).",6/11/14
20535,6/5/14,Eugene Weixel,"The TLC received my application to renew yellow medallion taxi driver license on May 23, 2014. The licence expires June 7, 2014. Why has this application not been approved ?",6/6/14
20539,6/5/14,Morrison Cohen LLP,"Copy of complete file of Duane D. Hamilton, TLC Summons No. 71020353A and your Notice of Vehicle Seizure No. EF71020353 all documents- Contracts, fee statements and all communications during 2013/14 between TLC and Knights Collision and Towing.",
20543,6/5/14,GUERRERO & ROSENGARTEN- Attorneys at law,Taxi Driver & Owner- Dipu Shrestha.,6/9/14
20548,6/5/14,Jed Pavlovich,"Driving history for taxi operator Jafri Syed taxi license # 430128 exp. 01/27/2015-History of complaintsMedallion # of car he was driving on January 24th/25th, 2014-name of cab company this medallion # is registered to",7/3/14
20550,6/5/14,M. Alexandre,"Copy of the complete transfer document dated April 5, 2006 for Henley Cab Corporation.",6/24/14
20544,6/6/14,Leonidas Calderon,All VIRs records for plate T639596C/ VIN: 1GNFK26329R24xxxx,6/10/14
20545,6/6/14,Hereford Insurance Company,What base Plate #T614252C was affiliated with on 05/18/2014.,6/9/14
20546,6/6/14,Hereford Insurance Company,GPS records/Trip sheets for Medallion 3D14C for 9/28/2013 to current.,6/9/14
20547,6/7/14,Member Brokerage Service,"drivers information regarding Medallion #1R52 for accident of 6/5/14, which occurred at JFK Taxi Stand, for client, Mr. Mikhail Yasayev,",6/9/14
20540,6/9/14,Kevin J. Dolan,NYC Taxi Trip Data from 2013-present,6/9/14
20541,6/9/14,Justin Cranshaw,NYC Taxi Trip Data from 2013-present,6/9/14
20549,6/9/14,Jeff Novich,"ALL summonses issued by the TLC to drivers in 2012/2013-  violation (ie consumer complaint, TLC enforcement, NYPD, etc)-ALL complaints submitted to 311 call center and 311 web submission form, with full text of the narratives-",7/24/14
20552,6/9/14,"Law Office of David S. Smith, LLC",Medallion plate number and contact information of the driver of taxi outside Gansevoort Hotel- near 18 9th Avenue in Manhattan around 7 pm on 6/1/2014.,6/17/14
20555,6/9/14,The Wall Street Journal,NYC taxi trip data and street hail livery trip data in machine readable format from 1/1/2013 - current.,8/4/14
20559,6/9/14,Hereford Insurance Company,A copy of Babar Majeed hack license #5271531 picture and GPS records/ Trip Sheets from 9/28/2013 to current.,6/12/14
20560,6/9/14,Hereford Insurance Company,A copy of Gulam Chowdhury hack license #504235 picture and GPS records/ Trip Sheets from 07/09/2012 to current.,6/12/14
20561,6/9/14,Hereford Insurance Company,Proof of Base affiliation on 1/13/14 for plate # T629651C.,6/12/14
20562,6/9/14,Avraham Wyszynski,"If there is a regulation that permits or prohibits the sale or transfer of an TLC Ambulette license.If yes, which regulation, was it in effect in March of 2011 and how can I print it.",6/12/14
20577,6/9/14,"Pike & Pike, PC",Complete TLC applications for: 1) Danach; and 2) Grun  two new TLC black car base applicants.,6/26/14
20585,6/9/14,Teaching Firms of America,"Request for Receipts/Audit:  2/3/14 - $88, 2/3/14 - $25, 2/11/14 - $19, 4/10/14 - $14, 5/1/14 - $8, 5/1/14 - $10.48, 5/12/14 - $9.95, 5/15/14 - $6.28",6/24/14
20551,6/10/14,Columbia University,LPEP data for the Boro Taxicabs.,6/12/14
20554,6/10/14,The Wall Street Journal,Collision Data,7/15/14
20556,6/10/14,"Shapiro Law Offices, PLLC",Ownership information on vehicle license plate number W202174C.,6/12/14
