FOIL ID,DATE OF REQUEST,REQUESTER,REGARDING,DATE RESPONSE
20719,7/19/14,Samantha White,lost tennis bracelet but I don't have the medallion number of the taxi that I was in.  I paid for the ride by credit card and I have the license number of the can driver.  Is there any way to track down the driver and contact the garage that he works for,7/21/14
20692,7/21/14,"O'Conner, O'Conner, Hintz & Deveney, LLP","Complete copy of income, expenses and dates of taxi operations records pertaining to Lamish Adelmajid from 1/24/12 to 2/24/13.",7/22/14
20728,7/21/14,Baron Associates P.C.,Owner and insurance Information for plate number T640845C,7/22/14
20729,7/21/14,"Silverman and Roedel, LLC",Insurance Information on license plate number 7E94H,7/22/14
20730,7/21/14,"Jay S. Knispel, LLC",Owner and insurance information for plate number 3G44C,7/22/14
20731,7/21/14,"Leav & Steinberg, LLP",Information on plate number 65219LA/ VIN #: 1FD3E35P28DB4xxxx,7/22/14
20745,7/21/14,Baldev Singh,Information on medallion #3C94 Prem Chand- How many time his license was suspended.,7/24/14
20748,7/21/14,"Law Office of Michael T. O' Leary, PLLC",Information on medallion 9C75C and File on driver: Dinel Velican-Gruia and Owner Serge Bonhomme.,8/4/14
20757,7/21/14,Princeton University,TPEP Data- Interested in 2005 data,7/28/14
20762,7/21/14,Sarowitz Milito & Co.,Cab drivers charges from 2012.,8/12/14
20763,7/21/14,Hereford Insurance Company,"GPS Records/Trip sheets for SHL permit # AC530, Plate # T611419C on 6/17/2014 to current",7/29/14
20771,7/21/14,Hereford Insurance Company,"GPS Reports for #488374 (2013-2014), #5419088 (2014), #5275508 (2014), #465521 (2014), #5464606 (2014) #5357119 (2013-2014), #5487067 (2013-2014).",7/31/14
20772,7/21/14,Hereford Insurance Company,"GPS Reports for #5478018 (2013-2014), #5402117 (2011-2014), #5245178 (2014), #5118950 (2011-2014), #428183 (2014) #478444 (2014), 5243388 (2012-2014).",7/31/14
20773,7/21/14,Hereford Insurance Company,"GPS Reports for #5306313 (2014), #5141994 (2013-2014), #460298 (2014), #5069935 (2014), #5285750 (2013-2014) #5306313 (2014).",7/31/14
20749,7/22/14,"Sacco & Fillas, LLP","Name, address and owner of plate # T603044C.",7/24/14
20758,7/22/14,Princeton University,NYC Taxi trip data (TPEP) from 1/1/2002 to 1/1/2009.,7/28/14
20759,7/22/14,Hereford Insurance Company,GPS records for a taxicab,7/25/14
20760,7/22/14,Conor Skelding-Reporter,"All communications, including emails and text messages, between Taxi and Limousine deputy commissioner Izabella Vais and Evgeny Freidman, Ethan Gerber, Michael Woloz, Ron Sherman and Matthew Daus between May 13, 2014-Current",9/25/14
20761,7/22/14,Rene Myatt,Name and address of insurance carrier of plate number OL8696H.,7/25/14
20770,7/22/14,ARDITO & ARDITO LLP,Owner and operator of taxi plate 120SBVB.,7/31/14
20742,7/23/14,"Sacco & Fillas, LLP","Name, address and Insurance of the owner of plate T644121C.",7/24/14
20765,7/23/14,Robert Petrick,Insurance information on MEDALLION # 6L67.,7/29/14
20767,7/23/14,Meir Soibelman,TLC # and Medallion lease info for Kamran Khalid.,7/29/14
20768,7/23/14,Meir Soibelman,TLC # and Medallion lease info for Kamran Khalid.,7/29/14
20769,7/23/14,Meir Soibelman,Any TLC Records regarding Shaheen Ahmed.,7/29/14
20750,7/24/14,McKenna Long & Aldridge LLP,"copy of any and all complaints filed by the Black Car Assistance Corporation (BCAC), the Livery RoundTable (LRT) and/or their respective attorneys and/or representatives about Uber Technologies",7/25/14
20753,7/24/14,Law Office of Vaccaro & White,Owner of Plate #T427879C.,7/25/14
20754,7/24/14,Aboubacar Diawara,License suspension record in 2014 for hack license number 5249493 (Aboubacar Diawara).,7/25/14
20755,7/24/14,"Law Office of Banilov & Associates, P.C.",Owner and Operator of taxi 1E98H.,7/25/14
20756,7/24/14,Giorgio Toader,"Letter showing in hack starting 1987 under hack license # 414873, 5355002 (Giorgio Toader).",7/25/14
20764,7/24/14,Gennady Yankilevich Esq.,"provide OWNER and INSURANCE info, for vehicle - 2010 TOYOTA omt, plate # T639155C",7/29/14
20766,7/24/14,Fairchild Fashion Media,"Trip sheet reports, if they are available for 6/26/14 $24.50 MED# 3M46 and 6/26/14 $ 20.50",8/4/14
20774,7/24/14,"Weiser & Associates, LLP","Vehicle, driver and insurance information for car #287 from New Harlem Car Service",7/31/14
20781,7/25/14,Hereford Insurance Company,A copy of Youssoufou Cisse - Hack # 444468 Picture .,7/31/14
20797,7/25/14,Hereford Insurance Company,"GPS records/Trip Sheets for SHL permit #AE354, Plate #T614252C on 5/1/14 to current.",8/4/14
20776,7/28/14,"Sacco & Fillas, LLP",Owner and Insurance information on plate T508313C.,7/31/14
20777,7/28/14,Jacoby & Meyers,Insurance Information on plate # T500323C.,7/31/14
20778,7/28/14,Viatchesly Pichuev,Records of all trips completed since having TLC license #5306447,8/7/14
20779,7/28/14,"Leav & Steinberg, LLP",Medallion Insurance information on plate 2M54H.,7/31/14
20784,7/28/14,Hereford Insurance Company,A copy of Osama Osman (Hack # 521439) picture.,7/31/14
20788,7/28/14,Jieli Diao,taxi receipt for a yellow cab I took from JFK airport to Downtown Manhattan,8/4/14
20798,7/28/14,Hereford Insurance Company,"GPS records/Trip Sheets for SHL permit #AB629, Plate #T624598C on 6/3/14 to current.",8/4/14
20818,7/28/14,The Lanier Law Firm,All documents relating to the following individual: Stephen Capchak,8/11/14
20819,7/28/14,jeremy@taximagic.com,"Application for Base License for the following bases: Weiter, Hinter, Schmecken, Danach, Grun, Unter and Atlas Travel and Limo, especially including Application to Operate, Zone Rate schedule map or Rate of Fare Book.",10/3/14
20863,7/28/14,"Law Office of Asta & Associates, P.C.",Documents (Financial Disclosure; Shareholders Personal Asser; Income & Net Worth) pertaining to Nixon Taxi Corp 3Y62/63.,8/20/14
20775,7/29/14,Shirley Shiver,Information on unlicensed driver working for base # B01552.,8/11/14
20786,7/29/14,"Israel, Israel & Purdy, LLP",Plate # T605497C Marco Alamchi- Date of Accident 2/3/14.,8/4/14
20789,7/29/14,"Quik Fund, Inc.",The legal owners of Medallion 9E96.,8/4/14
20864,7/29/14,Elizabeth Danai Melissakis,Transfer documents of May 12th 2010 concerning Maria & Maria Inc. from Omega to Astoria Taxi Leasing Company and a copy of the power of attorney submitted with the change of agent.,9/24/14
20787,7/30/14,"Gassler & O'Rourke, P.C.",Taxi Medallion owner name and address for plate number T521082C.,8/4/14
20790,7/30/14,Meir Soibelman,A copy of Shaheen Ahmed license # 467417.,8/4/14
20791,7/30/14,Mintz & Gold LLP,All records relating to Ashwini Chhabra.,
20792,7/30/14,"Pike & Pike, PC","complete contents of the TLC file on Black Car Base No. B02510, listed as Atlas Travel & Limousine, Inc. on the TLC website as of today, July 30, 2014",8/22/14
20793,7/30/14,F.M. Denicola,"Last filed, current address for owner/operator Lisa R. Huang Plate T610199C VIN# 2LM8L8CV7AX62xxxx",8/4/14
20799,7/30/14,Hereford Insurance Company,GPS records/Trip Sheets for License #5361067 and copy of lic picture.,8/4/14
20821,7/30/14,Alanna Nevins,All information regarding NYC Taxi and Limousine case no. 10020971.,8/7/14
20780,7/31/14,"Leav & Steinberg, LLP",Medallion Insurance information on plate 5M81C.,7/31/14
20782,7/31/14,"Hampton & Sontag, LLC",OWNERSHIP INFORMATION ON MEDALLION # 8M47H.,7/31/14
20783,7/31/14,Christopher Lasalle,Copy of expired FHV license # 5450029.,7/31/14
20785,7/31/14,Hereford Insurance Company,VIN# 4T1BD1FK1DU08xxxx (Base Affiliation),7/31/14
20794,7/31/14,"Lenox Car Services, Inc.",Proof that vehicle plate #T625616C is no longer affiliated with Lenox.  I submitted a TERMINATION OF AFFILIATION in Aug 2013.,8/4/14
20813,7/31/14,MTBOT,"Copies of any rates of fare filed by the following Black Car bases: Hinter, Weiter, Schmecken, Atlas Travel and Limousine, Grun, Danach.",8/25/14
20834,7/31/14,Kenny Rodriquez,Documents verifying owner of permit #AD993.,8/7/14
20838,7/31/14,"Pike & Pike, PC",This is a FOIL request for the complete submission made by Uber to the TLC to participate in the e-hail pilot program.,9/3/14
20795,8/1/14,Law Office of Scott Baron & Associates,Documentation confirming if plate # 9K30H has insurance coverage.,8/4/14
20796,8/1/14,Law Office of Scott Baron & Associates,Documentation confirming if plate # T501932C has insurance coverage.,8/4/14
20812,8/1/14,Yale Associates Information Services,Employment Verification for Karen Lee.,8/6/14
20820,8/1/14,"Cobert, Haber & Haber","A copy of the entire medallion transfer file of when the medallion was sold to Alisa Haitoff, the owner of 66.66% of Todo Taxi Inc.",10/9/14
20811,8/4/14,Michael Nwokolo,Information on lic #5548212 application denial.,8/6/14
20814,8/4/14,Sacco & Fillas LLP,Insurance information on Medallion 8J34H.,8/6/14
20816,8/4/14,maria angeles navarro navarro,Are there taxis for 5 people? Are they easy to get in the street? Do they have the same fare than the normal ones?,8/6/14
20817,8/4/14,BuzzFeed,"Information about the safety records of, disciplinary proceedings for, and disciplinary actions against TLC license-holders (current and former) since January 2000.",9/22/14
20822,8/4/14,Fairchild Fashion Media,"Trip sheet reports, 6/26/14 $ 20.50 AmEx #2003",8/6/14
20823,8/4/14,Hereford Insurance Company,GPS records for Wudu Touray Hack #448504 from 1/28/2010 to current.,8/6/14
20824,8/4/14,"Law Offices of Neil Kalra, P.C.","Trip sheet request for  Swaran Singh, d/O/B: 1/1/72, SS# 6120,. From 9/22/2013 to Present.",8/6/14
20840,8/4/14,Sarowitz Milito & Co.,Requesting Cab driver charges from 2012 (Pickup/Dropoffs and times) for Multiple dates- Card ending in 7831.,9/22/14
20626,8/5/14,"Law Office of Banilov & Associates, P.C.",Information on medallion 1E98H.,8/5/14
20815,8/5/14,Claudia Mauro,The Medallion #2K33 owner contact information.,8/6/14
20825,8/5/14,"Beirne Associates, Inc.",Name of medallion agent where Mr. Mohamed S. Osman Hack license #5117197 is currently driving for.,8/6/14
20826,8/5/14,Trace America,The employer of Medallion Taxi Driver Alagie Jobe license #5246248.,8/7/14
20841,8/5/14,Sarowitz Milito & Co.,equesting Cab driver charges from 2012 (Pickup/Dropoffs and times) for Multiple dates- Card ending in 7831.,9/22/14
20827,8/6/14,"Leav & Steinberg, LLP",Owner and Imsurance information for medalllion plate #1L38H.,8/7/14
20828,8/6/14,"Surdez & Perez, P.C.",Owner and Insurance information for medallion plate #5M39B.,8/7/14
20829,8/6/14,Gertrude Margolis,Receipt for taxi ride on 7/16/14 License #AF583 -Time: 5:40pm to 6:05pm.,8/7/14
20830,8/6/14,Rhonda Jones,Who license number 5473566 belongs to .,8/7/14
20833,8/6/14,Ahmed Soliman,All the information of any vehicle and owners of the vehicles under this permit #AD018.,8/7/14
20837,8/6/14,"Base and Associates, P.C.","All taxi Cabs that were present between 33rd and 34th Street and 7th avenue on June 11, 2014.",8/11/14
20857,8/6/14,"Wingate, Russotti, Shapiro & Halperin, LLP",Owner and Operator of Taxi 120SBVB.,8/18/14
20835,8/7/14,Nandini Balial,Official copy of Service Request C1-1-953347531 which was filed on 3/31/2014 for lost property.,8/8/14
20836,8/7/14,Majed Alsalaj,"Copy of the following license #s: 5371059, 5439930, 5476032, 5457325, 5485518, 5491880, 5498733, 5520134, 5520322, 5539880, 5544509, 5392372, 5400153, 5434124.",8/8/14
20839,8/7/14,Melvyn S. Jacknowitz,All licensing information for (Top City Car Service) including name and address of the owner. A copy of the business license  and all filings.,10/29/14
20842,8/7/14,Hereford Insurance Company,"GPS Reports for #5361067 (2014), #496436 (2014), #5300396 (2014), #5305059 (2013-2014), #5116260 (2013-2014), #462260 (2014), #5160456 (2011-2014).",8/12/14
20843,8/7/14,Hereford Insurance Company,"GPS Reports for #5141994 (2013-2014), #5056068 (2014), #461768 (2012-2014), #5187843 (2011-2014), #420898 (2013-2014), #5314317 (2012-2014), #479685 (2012-2014).",8/13/14
20844,8/7/14,Hereford Insurance Company,"GPS Reports for #5088163 (2013-2014), #5373067 (2013-2014), #5233243 (2013-2014), #5348445 (2012-2014), #470256 (2012-2014), #5078983 (2014), #480379 (2013).",8/13/14
20727,8/8/14,Jaclyn Fosso,"Taxi cab receipt from Transaction date on 7/31/14, Posting Date 8/4/14. It was for a total cost of $11.87 NYC-Taxi 6H81",8/8/14
20846,8/8/14,Brandy Coulibaly,Information on the owner or company of the vehicle with the license plate number T449894C.,8/13/14
20847,8/8/14,Hereford Insurance Company,Copy of hack license # 5439983 and 5011507 picture.,8/13/14
20848,8/8/14,Hereford Insurance Company,VIN # 2T2HK31U18C08xxxx (Base Affiliation),8/13/14
20849,8/8/14,Hereford Insurance Company,SHL permit # AA001 - Plate # T502927C (GPS Records) on 7/14/2014 to current.,8/13/14
20850,8/8/14,Hereford Insurance Company,SHL permit # AE674 - Plate # T619139C (GPS Records) on 1/1/2014 to current.,8/13/14
20851,8/8/14,"Law Office of Joseph A. Romagnolo, Esq.",Owner and Insurance Information on plate T464380C- Hany Yacuob D.O.A- 6/2/2014.,8/13/14
20862,8/8/14,"Law Office of Ryan S. Goldstein, P.L.L.C.",All records pertaining to hearing SR#1-1-844744201 (TLC Passenger Complaint) filed by Tiffanie Garrett.,8/18/14
20866,8/8/14,The Law Office of Thomas J. Lavin,"Identity of driver who struck pedestrain on 6/1/14 between 12am and 1:30am, near the eastern corner of 54th street and 10th avenue. Driver fled the scene of the accident.",8/18/14
20910,8/11/14,"Munawar Sandhu, Esq.",License record and information for Prem Chand.,8/25/14
20845,8/12/14,Laura Nanfra,Information on cab that was rear ended on 7/14/14 at 9pm near 400 West 34th Street and 9th Avenue.,8/13/14
20852,8/12/14,EVANS K. NYANTAKYI,Information on Summons # 1392144A.,8/13/14
20853,8/12/14,Hereford Insurance Company,MED # 9D20 (GPS Records) for 2/1/2014 to current.,8/13/14
20854,8/12/14,Hereford Insurance Company,Copy of hack license #5011507 picture.,8/13/14
20865,8/12/14,Finkelstein & Partners LLP,"Entire file, Ownership and lien information on medallion number 8J21A (Cabbo Service Corp.)",9/26/14
20877,8/12/14,Gerhard Schmidt,"Grant disbursement for AC311, AC878, and AC485",8/26/14
20878,8/12/14,Gerhard Schmidt,Grant Disbursement for AC538 and AC542,8/26/14
20879,8/12/14,Gerhard Schmidt,"Grant Disbursement for AC846, AC849, AC853, AC856 and AC858",8/26/14
20880,8/12/14,Gerhard Schmidt,Grant Disbursement for AC768 and AC769,8/26/14
20881,8/12/14,Gerhard Schmidt,"Grant disbursement for AC850, AC852, AC855 and AC857",8/26/14
20882,8/12/14,Gerhard Schmidt,Grant Disbursement for AC845 and AC847,8/26/14
20883,8/12/14,Gerhard Schmidt,Grant disbursement for AC825 and AC831,8/26/14
20884,8/12/14,Gerhard Schmidt,"Grant Disbursement for AC649. AC650, AC652 and AC653",8/26/14
20885,8/12/14,Gerhard Schmidt,Grand disbursement for AB536,8/26/14
20886,8/12/14,Gerhard Schmidt,Grant Disbursement for AC316,8/26/14
20887,8/12/14,Gerhard Schmidt,Grant Disbursement for AC281,8/26/14
20888,8/12/14,Gerhard Schmidt,Grant Disbursement for AC504,8/26/14
20889,8/12/14,Gerhard Schmidt,Grant Disbursement for AA235,8/26/14
20890,8/12/14,Gerhard Schmidt,Grant disbursement for AA544,8/26/14
20891,8/12/14,Gerhard Schmidt,Grant disbursement for AB268 and AB266,8/26/14
20911,8/12/14,Mobility Works,"Grant Disbursement for SHL Permit #'s AC783, AC788, AC786, AC785 and AC792.",8/26/14
20855,8/13/14,"Scott Baron & Associates, P.C.",Information on plate numbr T407001C.,8/13/14
20856,8/13/14,"Wingate, Russotti, Shapiro & Halperin, LLP",Owner and/or operator of the taxi plate #8F26B.,8/14/14
20907,8/13/14,Idalis Georgewale| Seyfarth Shaw LLP,All documents regading the licensing of Drivegreencab.com and its principal Steven Rozen.,8/25/14
20871,8/14/14,Arlene Mehlman,"Address, telephone number for Tahir, Zaim, IL, Abideen.",8/19/14
20858,8/15/14,"Wingate, Russotti, Shapiro & Halperin, LLP",Owner and/or operator of the taxi plate #6A72A.,8/18/14
20859,8/15/14,"Surdez & Perez, P.C.",Fanny Lenis Navia D/A:8-5-14 (Information on Plate T635500C),8/18/14
20860,8/15/14,"Surdez & Perez, P.C.",Gloria N. Rodriguez D/A: 8-5-14 (Information on Plate T635500C),8/18/14
20861,8/15/14,"Surdez & Perez, P.C.",Carlos A. Caicedo-Quesada D/A: 8-5-14 (Information on Plate T635500C),8/18/14
20874,8/15/14,Broad Dyckman Car Service Inc.,"Termination form signed by the president of Broad Dyckman Car Service Doroteo Genao- Vehicles Plate # T629140C, Plate # T522589C, Plate # 617825C",11/7/14
20912,8/15/14,Andrea Olson,Information on induction loops.,8/26/14
20909,8/17/14,Epoch Times,Five most recent summonses issusd to Uber bases.,9/16/14
20867,8/18/14,Raphealson & Levin Law Firm P.C.,Ownership information on medallion from 8/3/13-present. Insurance information from 8/3/13-present for plate #5E36H D/A:8/4/13,8/18/14
20868,8/18/14,"REVOLTJOED ESPERANCE","Receipts for taxi rides on 6/27, 7/9, 7/10, 7/11 Master Card  ending in 6626.",8/18/14
20869,8/18/14,Dan Nguyen,TLC trip and fare data.,8/18/14
20870,8/18/14,"Abend & Silber, PLLC",Driver or Taxi plate number 8J80H on 7/7/2014 at 12:15pm.,8/18/14
20872,8/18/14,"Jacoby & Meyers, LLP",Information on Plate number T634727C.,8/19/14
20873,8/18/14,Mahmoud H. Abu-Shaar,Information on TLC license 444313.,8/19/14
20875,8/18/14,Ralph Thomas Castaldo,TLC License application #5546546 denial. Requesting further review.,8/19/14
20876,8/18/14,Paris Peckerman,Trip Report request for 7/16/14 -total amount $15.62 (Medallion 7F63).,8/20/14
20892,8/18/14,Shirly Shiver,to provide all Affidavits and Dispatch Log Sheets associated with Complaint: SR# 1-1-981045870.,8/19/14
20945,8/18/14,"Malen & Associates, PC",Employment  and income verification for Dawn M Mitchell; ss:xx-xx-4195,9/8/14
20896,8/19/14,Boris Aynbinder,Records of old TLC  driver license (Boris Aynbinder).,8/21/14
20897,8/19/14,Sam Ba,Information on plate T527333C/ lic #5366006.,8/21/14
20901,8/19/14,"Abend & Silber, PLLC",Trip Sheet for taxi 5H54 from 7/7/2014.,8/22/14
20908,8/19/14,Hereford Insurance Company,GPS Records/Trip Sheets for SHL permit AF738,8/25/14
20893,8/20/14,Progressive Insurance,Activity Log for Medallion 1A89- 1/1/14-Current,8/20/14
20895,8/20/14,Jacoby & Meyers,Information on plate # 9N59B.,8/21/14
20900,8/20/14,Ken Wunderlich,"Current license status of Bassirou Seck, License number 5051482 and last known home address and last or current employer.",8/21/14
20906,8/20/14,"Brand, Glick & Brand, P.C.",Proof of ownership of NYC Taxi Medillion 2G15H,8/25/14
20913,8/20/14,"Pike & Pike, PC","The complete application to obtain a Street Hail Livery Endorsement, along with all attachments, for the following Base #B02765  Grun, LLC",1/9/15
20914,8/20/14,"Pike & Pike, PC","The complete application to obtain a Street Hail Livery Endorsement, along with all attachments, for the following: Base #B02539  Hawk Car & Limo Service",11/7/14
20916,8/20/14,MAHAMAN TAROT AMALI,Information on license # 5473854.,8/26/14
20948,8/20/14,Alex Stefman,"Signatures of Mikhail Abramov on behalf of B01710; 79 Masada III, Inc.",11/17/14
20894,8/21/14,Progressive Insurance,Who does license # 5095808 belong to.,8/21/14
20898,8/21/14,The Legal Aid Society,"Violation history, Criminal history of Ighide Nosakhare, All records bearing the signature of Ighide Nosakhare or reflecting any background investigation of Ighide Nosakhare,  records concerning an incident occurring on August 13, 2014.",9/17/14
20899,8/21/14,Progressive Insurance,Activity report for license number 5095808 from 3/21/14 to present.,8/21/14
20902,8/21/14,Brigham Young University,"TPEP 2012, 2013, 2014 Taxi Trip and Fare Data for Academic Research.",8/22/14
20903,8/21/14,Barbara Cabrera,Driving records for NYS License # 43328xxxx,8/22/14
20941,8/21/14,"Lauriano Guzman, Jr., Esq.",License Information of T483040C,9/4/14
20904,8/22/14,"Jonathan D'Agostino & Associates, P.C.","Employment and wage records for Shaha, Rajash D/A: 5/8/13.",8/22/14
20915,8/22/14,The Legal Aid Society,Information on Alam Iftekhar,8/28/14
20917,8/22/14,Ahdullah A. Al-Aswad,Name and address of the person who made complaint # 10023055C. Copy of letter sent by TLC.,8/26/14
20918,8/22/14,Hereford Insurance Company,Hack License # 470256 Picture,8/22/14
20919,8/22/14,Hereford Insurance Company,Permit AD530 - Plate # T635967C (GPS Record/Trip Sheet) for 6/23/2014 to current.,8/26/14
20922,8/22/14,Hereford Insurance Company,MED 9P33 (GPS Records/Trip Sheets) for 6/20/14 to current,8/26/14
20925,8/22/14,Hereford Insurance Company,"GPS Reports for #5438229 (2014), #5374295 (2013-2014), #462284 (2014), #5100801 (2012-2014), #5338558 (2011-2014), #5344237 (2014).",8/28/14
20926,8/22/14,Hereford Insurance Company,"GPS Reports for #5124737 (2014), #5370365 (2014), #466244 (2014), #479021 (2011-2014), #5437154 (2014), #5168979 (2013-2014), #445759 (2012-2014).",8/28/14
20927,8/22/14,Hereford Insurance Company,"GPS Reports for #5238011 (2014), #5478018 (2014), #5462741 (2013-2014), #5223508 (2013-2014), #5486920 (2014), #5470583 (2013-2014).",8/29/14
20928,8/22/14,Hereford Insurance Company,"GPS Reports for #362589 (2013-2014), #435027 (2013-2014), #5449349 (2013-2014), #385934 (2014), #5284079 (2014).",8/29/14
20938,8/22/14,"Baxter, Smith & Shapiro, P.C.",Employement information on Joseph Caputo.,9/4/14
20929,8/24/14,Alejandro Molnar,GPS TPEP Data,8/27/14
20905,8/25/14,Susan E. Sylvester,Jose Chacon- License # 428463,8/25/14
20920,8/25/14,Hereford Insurance Company,What base: Plate # T605728C was affiliated with on date of injury 12/22/13?,8/26/14
20940,8/25/14,"Tarasov & Associates, P.C.",License information for medallion 4L30B,9/4/14
20963,8/25/14,Silverman Shin Byrne & Gilchrest PLLC,License Information on Ismael Tarazona,9/15/14
20964,8/25/14,Hesham Hasabelnaby,Detailed records for 2 transactions on 8/6/14 made by CC ending in 3222 for $127 and $60.95 NYC-LPEP.,9/15/14
20921,8/26/14,Hereford Insurance Company,Which base: Plate #: T633631C was affiliated with on date of accident 8/30/13.,8/26/14
20923,8/26/14,Hereford Insurance Company,VIN # 1LNHM82W95Y62xxxx (Base Affiliation) 8/30/2013,8/26/14
20924,8/26/14,Harvard University,TPEP GPS - Trip and Fare data for 2009-Present,8/26/14
20930,8/26/14,Hereford Insurance Company,"SHL permit # AD504, Plate # T628047C",8/27/14
20932,8/26/14,"Y's Publishing Co., Inc.",Press Request for images of green taxis,8/27/14
20933,8/26/14,New York Yacht Club,Receipt for taxi ride on 8/7/14 Med#7P32 $9.00 - CC #2003,8/27/14
20951,8/26/14,"FR Conversions Inc, NYC Sales Rep",Copy of FR conversions assigned to permit on the list,10/21/14
20931,8/27/14,Hereford Insurance Company,A copy of Djafar Sambou Hack License #5398722 picture.,8/27/14
20934,8/27/14,Capital New York,"A list of all black car, community car and luxury limousine bases affiliated with the Executive Transportation Group and the Acierno family",10/16/14
20935,8/27/14,BARCLAYS,"Taxi receipt from July 23, 2014 for the amount of $15.00. The Medallion number is 1K18 and the credit card ends in 7275.",8/27/14
20937,8/27/14,"Wingate, Russotti, Shapiro & Helperin, LLP",Insurance information of medallion 8D92B,9/4/14
20942,8/27/14,John Hochfelder,Insurance information of T624598C,9/4/14
20943,8/27/14,"Sacco & Fillas, LLP",Insurance information on Medallion 6C15C,9/4/14
20936,8/28/14,Alliance Law PLLC,Sudeb C. Halder's most recent residential address and company name and address of Medallion # 3T33A.,8/29/14
20973,8/28/14,Hereford Insurance Company,Permit AB294 - Plate # T489197C (GPS Records) for 6/09/14 to current.,9/17/14
20968,8/28/14,Lori K. Smith,"NYC-TAXI, Astoria, New York8/18/2014 at approximately 8:40 PMPick up @ JFKPlease forward the duplicate receipt",9/15/14
20958,8/29/14,Department of Homeland Security,"Copy of the receipt for my taxi ride on 8/27/14 (19:44-19:53)- Hack number 5089065, Medallion number 6D65",9/12/14
20962,8/30/14,Yuval Netzer,Taxi Cab GPS (TPEP Data) records for 2011-2014.,9/15/14
20939,9/2/14,"Surdez & Perez, P. C.",Insurance information of Medallion 2J62B,9/4/14
20946,9/2/14,"Dinkes & Schwitzer, P.C.",Insurance Information of DMV plate #T626410C,9/9/14
20947,9/2/14,"Sanders, Sanders, Block, Woycik, Viener & Grossman",Owner's Information for Medallion 2F84,9/9/14
20972,9/2/14,Hereford Insurance Company,Plate # T649711C (Base Affiliation) as well as all current drivers,9/17/14
20974,9/2/14,Hereford Insurance Company,(Trip Sheets / GPS Records) for Medallion plate #2T41 for 10/27/2013 to 11/09/2013,9/17/14
20978,9/2/14,WSCE Corp.,Copy of Grant Check for Permit No. AA369,9/16/14
20954,9/2/14,"Salenger, Sack, Kimmel & Bavaro, LLP",License Information on Francisco Szasz #5354975,10/2/14
20956,9/2/14,Jacoby & Meyers,Insurance information on plate number T617332C and Market value of medallions.,9/12/14
20967,9/2/14,Amber Dixon,Trip record of taxi ride on 1/14-1/15/2014. Taxi pick up at 53 W 35th Street NYC.,9/15/14
20966,9/2/14,WSCE Corp.,Copy of Grant Check for Permit No. AA462.,9/15/14
21004,9/2/14,Member Brokerage Service LLC,"All regarding Workers Compensation coverage information for the dates 3/26/2004  11/28/2004. More specifically, I am in need of an EXEMPTION letter or a Workers Compensation POLICY in force during that time.",9/22/14
20975,9/3/14,Hereford Insurance Company,"GPS records/trip reports for Medallions: 8Y84 Dates:  6/28/14  7/15/14, 4Y53 Dates: 1/25/14  1/27/14, 9N15 Dates: 12/25/12  12/29/12, 2E16 Dates:  1/1/14  1/5/14, 8D84 Dates:",9/17/14
20944,9/4/14,NCDSS,License information on gurvinder Singh,9/8/14
20971,9/4/14,Timothy P Culkin,Investigation on Fernando Rodriguez- We are requesting copies of the Application & License for Mr. Rodriguez along with a copy of the NYS DMV Form 19A (Completed Form); ,9/23/14
20953,9/4/14,ABOUBACAR DIAWARA,Name and address of the complaining witness regarding stipulation: 100275765,9/22/14
